,name,presentation type,github link,stars
521,"Unsupervised Event-based Learning of Optical Flow, Depth, and Egomotion",Poster,,0
522,Modeling Local Geometric Structure of 3D Point Clouds using Geo-CNN,Poster,,0
523,GS3D: An Efficient 3D Object Detection Framework for Autonomous Driving,Poster,,0
524,3DN: 3D Deformation Network,Poster,,0
525,Deep Relational Reasoning Network for Monocular 3D Object Detection,Poster,,0
526,Pushing the Envelope for RGB-based Dense 3D Hand Pose Estimation via Neural Rendering,Poster,,0
527,FSA-Net: Learning Fine-Grained Structure Aggregation for Head Pose Estimation from a Single Image,Poster,,0
528,Dense 3D Face Decoding over 2500FPS: Joint Texture \& Shape Convolutional Mesh Decoders,Poster,,0
529,Does Learning Specific Features for Related Parts Help Human Pose Estimation?,Poster,,0
530,Towards High-fidelity Nonlinear 3D Face Morphoable Model,Poster,,0
531,Deep Face Recognition via Exclusive Regularization,Poster,,0
532,BridgeNet: A Continuity-Aware Probabilistic Network for Age Estimation,Poster,,0
533,Improving the Performance of Unimodal Dynamic Hand-Gesture Recognition with Multimodal Training,Poster,,0
534,Distilled Person Re-identification: Towards a More Scalable System,Poster,,0
535,A Perceptual Prediction Framework for Self Supervised Event Segmentation,Poster,,0
536,COIN: A Large-scale Dataset for Comprehensive Instruction Video Analysis,Poster,,0
537,Recurrent Attentive Zooming for Joint Crowd Counting and Precise Localization,Poster,,0
538,An Attention Enhanced Graph Convolutional LSTM Network for Skeleton-Based Action Recognition,Poster,,0
539,Graph Convolutional Label Noise Cleaner: Train a Plug-and-play Action Classifier for Anomaly Detection,Poster,,0
540,MAN: Moment Alignment Network for Natural Language Moment Retrieval via Iterative Graph Adjustment,Poster,,0
541,Less is More: Learning Highlight Detection from Video Duration,Poster,,0
542,DMC-Net: Generating Discriminative Motion Cues for Fast Compressed Video Action Recognition,Poster,,0
543,AdaFrame: Adaptive Frame Selection for Fast Video Recognition,Poster,,0
544,Spatio-temporal Video Re-localization by Warp LSTM,Poster,,0
545,Completeness Modeling and Context Separation for Weakly Supervised Temporal Action Localization,Poster,,0
546,Object Tracking by Reconstruction with View-Specific Discriminative Correlation Filters,Poster,,0
547,SoPhie: An Attentive GAN for Predicting Paths Compliant to Social and Physical Constraints,Poster,,0
548,Target-Aware Deep Tracking,Poster,,0
549,Towards Rich Feature Discovery with Class Activation Maps Augmentation for Person Re-Identification,Poster,,0
550,Semantic Regeneration Network,Poster,,0
551,End-to-End Time-lapse Video Synthesis from a Single Outdoor Image,Poster,,0
552,GIF2Video: Color Dequantization and Temporal Interpolation of GIF images,Poster,,0
553,PAGE-Net: Salient Object Detection with Pyramid Attention and Salient Edge,Poster,,0
554,Latent Filter Scaling for Multimodal Unsupervised Image-to-Image Translation,Poster,,0
555,Feedback Adversarial Learning: Spatial Feedback for Improving Generative Adversarial Networks,Poster,,0
556,Example-Guided Image Synthesis using Adversarial Networks with Genre Consistency,Poster,,0
557,MirrorGAN: Learning Text-to-image Generation by Redescription,Poster,,0
558,Light Field Messaging with Deep Photographic Steganography,Poster,,0
559,Im2Pencil: Controllable Pencil Illustration from Photographs,Poster,,0
560,When Color Constancy Goes Wrong: Correcting Improperly White-Balanced Images,Poster,,0
561,Beyond Volumetric Albedo --- A Surface Optimization Framework for Non-Line-of-Sight Imaging,Poster,,0
562,Reflection Removal Using A Dual-Pixel Sensor,Poster,,0
563,Practical Coding Function Design for Time of Flight Imaging,Poster,,0
564,Zoom in with Meta-SR: A Magnification-Arbitrary Network for Super-Resolution,Poster,,0
565,Multispectral and Hyperspectral Image Fusion by MS/HS Fusion Net,Poster,,0
566,Blind Super-Resolution With Iterative Kernel Correction,Poster,,0
567,Video Magnification in the Wild: Using Fractional Anisotropy in Temporal Distribution,Poster,,0
568,Attentive Feedback Network for Boundary-Aware Salient Object Detection,Poster,,0
569,Learning to Calibrate Straight Lines for Fisheye Image Rectification,Poster,,0
570,Frame-Consistent Recurrent Video Deraining with Dual-Level Flow,Poster,,0
571,Sea-thru: A Method to Remove Water From Underwater Images,Poster,,0
572,Deep Network Interpolation for Continuous Imagery Effect Transition,Poster,,0
573,Spatially Variant Linear Representation Models for Joint Filtering,Poster,,0
574,Toward Convolutional Blind Denoising of Real-world Noisy Photographs,Poster,,0
575,Towards Real Scene Super-Resolution with Raw Images,Poster,,0
576,ODE-inspired Network Design for Single Image Super-Resolution,Poster,,0
577,Blind Image Deblurring With Local Maximum Gradient Prior,Poster,,0
578,Attention-guided Network for Ghost-free High Dynamic Range Imaging,Poster,,0
579,Searching for A Robust Neural Architecture in Four GPU Hours,Poster,,0
580,Hierarchy Denoising Recursive Autoencoders for 3D Scene Layout Prediction,Poster,,0
581,Adaptively-Connected Neural Network,Poster,,0
582,CrDoCo: Pixel-level Domain Transfer with Cross-Domain Consistency,Poster,,0
583,Temporal Cycle-Consistency Learning,Poster,,0
584,Predicting Future Frames using Retrospective Cycle GAN,Poster,,0
585,Density Map Regression Guided Detection Network for RGB-D Crowd Counting and Localization,Poster,,0
586,TAFE-Net: Task-Aware Feature Embeddings for Efficient Learning and Inference,Poster,,0
587,Learning Semantic Segmentation from Synthetic Data: A Geometrically Guided Input-Output Adaptation Approach,Poster,,0
588,Attentive Single-tasking of Multiple Tasks,Poster,,0
589,FastAP: Deep Metric Learning to Rank,Poster,,0
590,Self-Supervised Learning via Conditional Motion Propagation,Poster,,0
591,Bridging Stereo Matching and Optical Flow via Spatiotemporal Correspondence,Poster,,0
592,All about Structure: Adapting Structural Information across Domains for Boosting Semantic Segmentation,Poster,,0
593,Iterative Reorganization with Weak Spatial Constraints:Solving Arbitrary Jigsaw Puzzles for Unsupervised Representation Learning,Poster,,0
594,It’s not about the Journey; It’s about the Destination: Following Soft Paths under Question-Guidance for Visual Reasoning,Poster,,0
595,Actively Seeking and Learning from Live Data,Poster,,0
596,Improving Referring Expression Grounding with Cross-modal Attention-guided Erasing,Poster,,0
597,Neighbourhood Watch: Referring Expression Comprehension via Language-guided Graph Attention Networks,Poster,,0
598,Scene Graph Generation with External Knowledge and Image Reconstruction,Poster,,0
599,Polysemous Visual-Semantic Embedding for Cross-Modal Retrieval,Poster,,0
600,Information Maximizing Visual Question Generation,Poster,,0
601,Learning to Detect Human-Object Interactions with Knowledge,Poster,,0
602,Learning Words by Drawing Images,Poster,,0
603,Reducing Uncertainty in Undersampled MRI Reconstruction with Active Acquisition,Poster,,0
604,ESIR: End-to-end Scene Text Recognition via Iterative Image Rectification,Poster,,0
605,ROI-10D: Monocular Lifting of 2D Detection to 6D Pose and Metric Shape,Poster,,0
606,Collaborative Learning of Semi-Supervised Segmentation and Classification for Medical Images,Poster,,0
607,Biologically-Constrained Graphs for Global Connectomics Reconstruction,Poster,,0
608,P3SGD: Patient Privacy Preserving SGD for Regularizing Deep CNNs in Pathological Image Classification,Poster,,0
609,Elastic Boundary Projection for 3D Medical Imaging Segmentation,Poster,,0
610,SIXray: A Large-scale Security Inspection X-ray Benchmark for Prohibited Item Discovery in Overlapping Images,Poster,,0
611,Gotta Adapt ’Em All: Joint Pixel and Feature-Level Domain Adaptation for Recognition in the Wild,Poster,,0
612,Circulant Binary Convolutional Networks: Enhancing the Performance of 1-bit DCNNs with Circulant Back Propagation,Poster,,0
613,DeFusionNET: Defocus Blur Detection via Recurrently Fusing and Refining Multi-scale Deep Features,Poster,,0
614,Virtual Networks for Memory Efficient Inference of Multiple Tasks,Poster,,0
615,Universal Domain Adaptation,Poster,,0
616,Sequence-to-Sequence Domain Adaptation Network for Robust Text Image Recognition,Poster,,0
617,Hybrid-Attention based Decoupled Embedding Learning for Zero-Shot Image Retrieval,Poster,,0
618,Learning to sample,Poster,,0
619,Few-Shot Learning via Saliency-guided Hallucination of Samples,Poster,,0
620,Variational Convolutional Neural Network Pruning,Poster,,0
621,Towards Optimal Structured CNN Pruning via Generative Adversarial Learning,Poster,,0
622,Fully Quantized Network for Object Detection,Poster,,0
623,"Student Becoming the Master: Knowledge Amalgamation for Joint Scene Parsing, Depth Estimation, and More",Poster,,0
624,K-Nearest Neighbors Hashing,Poster,,0
625,Learning RoI Transformer for Oriented Object Detection in Aerial Images,Poster,,0
626,Snapshot Distillation: Teacher-Student Optimization in One Generation,Poster,,0
627,Geometry-Aware Distillation for Indoor Semantic Segmentation,Poster,,0
628,LiveSketch: Query Perturbations for Guided Sketch-based Visual Search,Poster,,0
629,OCGAN: One-class Novelty Detection Using GANs with Constrained Latent Representations,Poster,,0
630,Separate to Adapt: Open Set Domain Adaptation via Progressive Separation,Poster,,0
631,Layout-Graph Reasoning for Fashion Landmark Detection,Poster,,0
632,DistillHash: Unsupervised Deep Hashing by Distilling Data Pairs,Poster,,0
633,Mind Your Neighbours: Image Annotation with Metadata Neighbourhood Graph Co-Attention Networks,Poster,,0
634,Region Proposal by Guided Anchoring,Poster,,0
635,Distant Supervised Centroid Shift: A Simple and Efficient Approach to Visual Domain Adaptation,Poster,,0
636,Learning to Transfer Examples for Partial Domain Adaptation,Poster,,0
637,Generalized Zero-Shot Recognition based on Visually Semantic Embedding,Poster,,0
638,Amodal Instance Segmentation through KINS Dataset,Poster,,0
639,Global Second-order Pooling Convolutional Networks,Poster,,0
640,Weakly Supervised Complementary Parts Models for Image Classification from the Bottom Up,Poster,,0
641,"NetTailor: Tuning the architecture, not just the weights",Poster,,0
642,Learning-based Sampling for Natural Image Matting,Poster,,0
643,Learning Unsupervised Video Object Segmentation through Visual Attention,Poster,,0
644,4D Spatio-Temporal ConvNet: Minkowski Convolutional Neural Network,Poster,,0
645,Pyramid Feature Selective Network for Saliency detection,Poster,,0
646,Co-saliency Detection via Mask-guided Fully Convolutional Networks with Multi-scale Label Smoothing,Poster,,0
647,SAIL-VOS: Semantic Amodal Instance Level Video Object Segmentation - A Synthetic Dataset and Baselines,Poster,,0
648,Learning Instance Activation Maps for Weakly Supervised Instance Segmentation,Poster,,0
649,Box-driven Class-wise Region Masking and Filling Rate Guided Loss for Weakly Supervised Semantic Segmentation,Poster,,0
650,InverseRenderNet: Learning single image inverse rendering,Poster,,0
651,A Variational Auto-Encoder Model for Stochastic Point Processes,Poster,,0
652,Unifying Heterogeneous Classifiers with Distillation,Poster,,0
653,Assessment of Faster-RCNN in Man-Machine collaborative search,Poster,,0
654,OK-VQA: A Visual Question Answering Benchmark Requiring External Knowledge,Poster,,0
655,Spectral Metric for Dataset Complexity Assessment,Poster,,0
656,ADCrowdNet: An Attention-injective Deformable Convolutional Network for Crowd Understanding,Poster,,0
657,Feature Distance Adversarial Network for Vehicle Re-Identification,Poster,,0
658,3D Local Features for Direct Pairwise Registration,Poster,,0
659,SPLFlowNet: Sparse Permutohedral Lattice FlowNet for Scene Flow Estimation on Large-scale Point Clouds,Poster,,0
660,GPSfM: Global Projective SFM Using Algebraic Constraints\\ on Multi-View Fundamental Matrices,Poster,,0
661,Multi-Level Context Ultra-Aggregation for Stereo Matching,Poster,,0
662,"Large-Scale, Metric Structure from Motion for Unordered Light Fields",Poster,,0
663,Understanding the Limitations of CNN-based Absolute Camera Pose Regression,Poster,,0
664,DeepLiDAR: Deep Surface Normal Guided Depth Prediction for Outdoor Scene from Sparse LiDAR Data and Single Color Image,Poster,,0
665,Modeling Point Clouds with Self-Attention and Gumbel Subset Sampling,Poster,,0
666,Learning with Batch-wise Optimal Transport Loss for 3D Shape Recognition,Poster,,0
667,Dense Depth Posterior (DDP) from Single Image and Sparse Range,Poster,,0
668,DuLa-Net: A Dual-Projection Network for Estimating Room Layouts from a Single RGB Panorama,Poster,,0
669,Veritatem Dies Aperit - Temporally Consistent Depth Prediction Enabled by a Multi-Task Geometric and Semantic Scene Understanding Approach,Poster,,0
670,Exploiting temporal context for 3D human pose estimation in the wild,Poster,,0
671,What Do Single-view 3D Reconstruction Networks Learn?,Poster,,0
672,UniformFace: Learning Deep Equidistributed Representation for Face Recognition,Poster,,0
673,Semantic Graph Convolutional Networks for 3D Human Pose Regression,Poster,,0
674,Mask-Guided Portrait Editing with Conditional GANs,Poster,,0
675,Group Sampling Networks for Scale Invariant Face Detection,Poster,,0
676,Joint Representation and Estimator Learning for Facial Action Unit Intensity Estimation,Poster,,0
677,Semantic Alignment: Finding Semantically Consistent Ground-truth for Facial Landmark Detection,Poster,,0
678,LAEO-Net: revisiting people Looking At Each Other in videos,Poster,,0
679,Robust Facial Landmark Detection via Occlusion-adaptive Deep Networks,Poster,,0
680,Learning Individual Styles of Conversational Gesture,Poster,,0
681,"Face Anti-Spoofing: Model Matters, So Does Data",Poster,,0
682,Decorrelated Adversarial Learning for Age-Invariant Face Recognition,Poster,,0
683,D3TW: Discriminative Differentiable Dynamic Time Warping for Weakly Supervised Action Alignment and Segmentation,Poster,,0
684,Progressive Teacher-student Learning for Early Action Prediction,Poster,,0
685,Social Relation Recognition from Videos via Multi-scale Spatial-Temporal Reasoning,Poster,,0
686,Transferable Interactiveness Prior for Human-Object Interaction Detection,Poster,,0
687,Multi-granularity Generator for Temporal Action Proposal,Poster,,0
688,Deep Structured Scene Flow,Poster,,0
689,"See More, Know More: Unsupervised Video Object Segmentation with Co-Attention Siamese Networks",Poster,,0
690,Patch Based Discriminative Feature Learning for Unsupervised Person Re-identification,Poster,,0
691,SPM-Tracker: Series-Parallel Matching for Real-Time Visual Object Tracking,Poster,,0
692,Spatial Fusion GAN for Image Synthesis,Poster,,0
693,Text Guided Person Image Synthesis,Poster,,0
694,STGAN: A Unified Selective Transfer Network for Arbitrary Image Attribute Editing,Poster,,0
695,Towards Instance-level Image-to-Image Translation,Poster,,0
696,Dense Intrinsic Appearance Flow for Human Pose Transfer,Poster,,0
697,Deep Flow Guided Video Inpainting,Poster,,0
698,Polarimetric Camera Calibration Using an LCD Monitor,Poster,,0
699,Fully Automatic Video Colorization with Self Regularization and Diversity,Poster,,0
700,"Zoom to Learn, Learn to Zoom",Poster,,0
701,Single Image Reflection Removal Beyond Linearity,Poster,,0
702,Learning to Separate Multiple Illuminants in a Single Image,Poster,,0
703,Shape Unicode: A Unified Shape Representation,Poster,,0
704,Robust Video Stabilization by Optimization in CNN Weight Space,Poster,,0
705,Learning Linear Transformations for Fast Image and Video Style Transfer,Poster,,0
706,Local detection of stereo occlusion boundaries,Poster,,0
707,Dynamic Scene Deblurring with Parameter Selective Sharing and Nested Skip Connections,Poster,,0
708,Events-to-Video: Bringing Modern Computer Vision to Event Cameras,Poster,,0
709,Semi-supervised Transfer Learning for Image Rain Removal,Poster,,0
710,EventNet: Asynchronous recursive event processing,Poster,,0
711,Recurrent Back-Projection Network for Video Super-resolution,Poster,,0
712,A Simple Pooling-Based Design for Real-Time Salient Object Detection,Poster,,0
713,Contrast Prior and Fluid Pyramid Integration for RGBD Salient Object Detection,Poster,,0
714,Progressive Image Deraining Networks: Simpler and Better,Poster,,0
715,GSPN: Generative Shape Proposal Network for 3D Instance Segmentation in Point Cloud,Poster,,0
716,Attentive Relational Networks for Mapping Images to Scene Graphs,Poster,,0
717,Relational Knowledge Distillation,Poster,,0
718,Compressing Convolutional Neural Networks via Factorized Convolutional Filters,Poster,,0
719,DeepMDS: Non-Linear Projection of Deep Representations,Poster,,0
720,Part-regularized Near-Duplicate Vehicle Re-identification,Poster,,0
721,Classification-Reconstruction Learning for Open-Set Recognition,Poster,,0
722,Emotion-Aware Human Attention Prediction,Poster,,0
723,Residual Regression with Semantic Prior for Crowd Counting,Poster,,0
724,Context-Reinforced Semantic Segmentation,Poster,,0
725,Adversarial Structure Matching for Structured Prediction Tasks,Poster,,0
726,Deep Spectral Clustering using Dual Autoencoder Network,Poster,,0
727,Deep Asymmetric Metric Learning via Rich Relationship Mining,Poster,,0
728,Did it change? Learning to Detect Point-of-Interest Changes for Proactive Map Updates,Poster,,0
729,"Pattern-Affinitive Propagation across Depth, Surface Normal and Semantic Segmentation",Poster,,0
730,Scene Categorization from Contours: Medial Axis Based Salience Measures,Poster,,0
731,Unsupervised Image Captioning,Poster,,0
732,Adversarial Attack to Image Captioning via Structured Output Learning with Latent Variables,Poster,,0
733,Cross-Modal Relationship Inference for Grounding Referring Expressions,Poster,,0
734,What's to know? Uncertainty as a Guide to Asking Goal-oriented Questions,Poster,,0
735,Iterative Alignment Network for Continuous Sign Language Recognition,Poster,,0
736,Neural Sequential Phrase Grounding (SeqGROUND),Poster,,0
737,CLEVR-Ref+: Diagnosing Visual Reasoning with Referring Expressions,Poster,,0
738,Describing like Humans: on Diversity in Image Captioning,Poster,,0
739,MSCap: Multi-Style Image Captioning with Unpaired Stylized Text,Poster,,0
740,Towards Accurate Task Accomplishment with Low-Cost Robotic Arms,Poster,,0
741,Networks for Joint Affine and Non-parametric Image Registration,Poster,,0
742,Learning Shape-Aware Embedding for Scene Text Detection,Poster,,0
743,Learning to Film from Professional Human Motion Videos,Poster,,0
744,Pay attention! - Robustifying a Deep Visuomotor Policy through Task-Focused Visual Attention,Poster,,0
745,Deep Blind Video Decaptioning by Temporal Aggregation and Recurrence,Poster,,0
746,Sensitive-Sample Fingerprinting of Deep Neural Networks,Poster,,0
747,Soft Labels for Ordinal Regression,Poster,,0
748,Local to Global Learning for Deep Neural Networks,Poster,,0
749,"What does it mean to learn in deep networks? And, how does one detect adversarial attacks?",Poster,,0
750,Handwriting Recognition in Low-resource Scripts using Adversarial Learning,Poster,,0
751,Adversarial Defense Through Network Profiling Based Path Extraction,Poster,,0
752,RENAS: Reinforced Evolutionary Neural Architecture Search,Poster,,0
753,Co-Occurrence Neural Network,Poster,,0
754,SpotTune: Transfer Learning through Adaptive Fine-tuning,Poster,,0
755,Signal-to-Noise Ratio: A Robust Distance Metric for Deep Metric Learning,Poster,,0
756,Detection based Defense against Adversarial Examples from the Steganalysis Point of View,Poster,,0
757,Blind Geometric Distortion Correction on Images Through Deep Learning,Poster,,0
758,Density Aware Deep Metric Learning,Poster,,0
759,Contrastive Adaptation Network for Unsupervised Domain Adaptation,Poster,,0
760,LP-3DCNN: Unveiling Local Phase in 3D Convolutional Neural Networks,Poster,,0
761,Attribute-Driven Feature Disentangling and Temporal Aggregation for Video Person Re-Identification,Poster,,0
762,Binary Ensemble Neural Network: More Bits per Network or More Networks per Bit?,Poster,,0
763,Distilling Object Detectors with Fine-grained Feature Imitation,Poster,,0
764,Knockoff Nets: Stealing Functionality of Black-Box Models,Poster,,0
765,Deep Embedding Learning with Discriminative Sampling Policy,Poster,,0
766,Hybrid Task Cascade for Instance Segmentation,Poster,,0
767,Multi-task Self-Supervised Object Detection via Recycling of Bounding Box Annotations,Poster,,0
768,ClusterNet: Deep Hierarchical Cluster Network with Rigorously Rotation-Invariant Representation for Point Cloud Recognition,Poster,,0
769,Learning to Learn Relation for Important People Detection in Still Images,Poster,,0
770,Looking for the devil in the details: Learning Trilinear Attention Sampling Network for Fine-grained Image Recognition,Poster,,0
771,Multi-Similarity Loss with General Pair Weighting for Deep Metric Learning,Poster,,0
772,Domain-Symmetric Networks for Adversarial Domain Adaptation,Poster,,0
773,End-to-End Supervised Product Quantization for Image Search and Retrieval,Poster,,0
774,Learning to Learn from Noisy Labeled Data,Poster,,0
775,DSFD:Dual Shot Face Detector,Poster,,0
776,Label propagation for Deep Semi-supervised Learning,Poster,,0
777,Deep Global Generalized Gaussian Networks,Poster,,0
778,Context-Aware Crowd Counting,Poster,,0
779,Towards Accurate One-Stage Object Detection with AP-Loss,Poster,,0
780,On Exploring Indeterminate Relationships for Visual Relationship Detection,Poster,,0
781,Learning without Memorizing,Poster,,0
782,Dynamic Recursive Neural Network,Poster,,0
783,Destruction and Construction Learning for Fine-grained Image Recognition,Poster,,0
784,Distraction-aware Shadow Detection,Poster,,0
785,Multi-Label Image Recognition with Graph Convolutional Networks,Poster,,0
786,RepMet: Representative-based metric learning for classification and few-shot object detection,Poster,,0
787,Ranked List Loss for Deep Metric Learning,Poster,,0
788,CANet: Class-Agnostic Segmentation Networks with Iterative Refinement and Attentive Few-Shot Learning,Poster,,0
789,KE-GAN: Knowledge Embedded Generative Adversarial Networks for Semi-Supervised Scene Parsing,Poster,,0
790,Fast User-Guided Video Object Segmentation by Interaction-and-Propagation Networks,Poster,,0
791,Fast Interactive Object Annotation with Curve-GCN,Poster,,0
792,FickleNet: Weakly and Semi-supervised Semantic Image Segmentation using Stochastic Inference,Poster,,0
793,End-to-End Recurrent Net for Video Object Segmentation,Poster,,0
794,Interactive Image Segmentation via Backpropagating Refinement Scheme,Poster,,0
795,Scene Parsing via Integrated Classification Model and Variance-Based Regularization,Poster,,0
796,RAVEN: A Dataset for Relational and Analogical Visual rEasoNing,Poster,,0
797,Surface Reconstruction from Normals: A Robust DGP-based Discontinuity Preservation Approach,Poster,,0
798,"DeepFashion2: A Versatile Benchmark for Detection, Pose Estimation, Segmentation and Retrieval of Clothing Images",Poster,,0
799,Jumping Manifolds: Geometry Aware Dense Non-Rigid Structure from Motion,Poster,,0
800,LVIS: A Dataset for Large Vocabulary Instance Segmentation,Poster,,0
801,Fast Object Class Labelling via Speech,Poster,,0
802,Creative Flow+ Dataset,Poster,,0
803,Weakly Supervised Open-set Domain Adaptation by Dual-domain Collaboration,Poster,,0
804,A Neurobiological Evaluation Metric for Neural Network Model Search,Poster,,0
805,Iterative Projection and Matching: Finding Structure-preserving Representatives and Its Application to Computer Vision,Poster,,0
806,Efficient Multi-Domain Learning by Covariance Normalization,Poster,,0
807,Predicting visible image differences under varying display brightness and viewing distance,Poster,,0
808,ApolloCar3D: A Large 3D Car Instance Understanding Benchmark for Autonomous Driving,Poster,,0
809,Compressing Unknown Classes with Product Quantizer for Efficient Zero-Shot Classification,Poster,,0
810,Self-Supervised Convolutional Subspace Clustering Network,Poster,,0
811,Multi-Scale Geometric Consistency Guided Multi-View Stereo,Poster,,0
812,Privacy Preserving Image-based Localization,Poster,,0
813,SimulCap : Single-View Human Performance Capture with Cloth Simulation,Poster,,0
814,Hierarchical deep stereo matching on high-resolution images,Poster,,0
815,Synthesizing 3D Shapes from Unannotated Image Collections using Multi-projection Generative Adversarial Networks,Poster,,0
816,Recurrent Neural Network for (Un-)supervised Learning of Monocular Video Visual Odometry and Depth,Poster,,0
817,PointWeb: Enhancing Local Neighborhood Features for Point Cloud Processing,Poster,,0
818,Scan2Mesh: From Unstructured Range Scans to 3D Meshes,Poster,,0
819,Unsupervised Domain Adaptation for ToF Data Denoising with Adversarial Learning,Poster,,0
820,Learning Independent Object Motion from Unlabelled Stereoscopic Videos,Poster,,0
821,Learning Single-Image Depth from Videos using Quality Assessment Networks,Poster,,0
822,Learning 3D Human Dynamics from Video,Poster,,0
823,Unsupervised Learning of Depth from Defocus Using a Gaussian PSF Layer,Poster,,0
824,Bilateral Cyclic Constraint and Adaptive Regularization for Monocular Depth Prediction,Poster,,0
825,Face Parsing with RoI Tanh-warping,Poster,,0
826,Multi-person Articulated Tracking with Spatial and Temporal Embeddings,Poster,,0
827,Multi-Person Pose Estimation with Enhanced Channel-wise and Spatial Information,Poster,,0
828,A Compact Embedding for Facial Expression Similarity,Poster,,0
829,High-Resolution Representation Learning for Human Pose Estimation,Poster,,0
830,Feature Transfer Learning for Face Recognition with Under-Represented Data,Poster,,0
831,Unsupervised 3D Pose Estimation with Geometric Self-Supervision,Poster,,0
832,Peeking into the future: Predicting Future Person Activities and Locations in Videos,Poster,,0
833,Re-Identification with Consistent Attentive Siamese Networks,Poster,,0
