,name,presentation type,github link,stars
213,SDRSAC: Semidefinite-Based Randomized Approach for Robust Point Cloud Registration without Correspondences,Oral,https://github.com/intellhave/SDRSAC,3
214,Activity Driven Weakly Supervised Object Detection,Poster,https://github.com/zhenheny/ADWSOD,3
215,Dynamics are Important for the Recognition of Equine Pain in Video,Poster,https://github.com/sofiabroome/painface-recognition,3
216,SIGNet: Semantic Instance Aided Unsupervised 3D Geometry Perception,Poster,https://github.com/mengyuest/SIGNet,3
217,AIRD: Adversarial Learning Framework for Image Repurposing Detection,Poster,https://github.com/isi-vista/AIRD-Datasets,3
218,Learning to Remember: A Synaptic Plasticity Driven Framework for Continual Learning,Poster,https://github.com/SAP/machine-learning-dgm,3
219,Instance-Level Meta Normalization,Poster,https://github.com/Gasoonjia/ILM-Norm,3
220,ContactDB: Analyzing and Predicting Grasp Contact via Thermal Imaging,Oral,https://github.com/samarth-robo/contactdb_prediction,2
221,Robustness of 3D Deep Learning in an Adversarial Setting,Poster,https://github.com/matthewwicker/IterativeSalienceOcclusion,2
222,Representation Similarity Analysis for Efficient Task taxonomy & Transfer Learning,Poster,https://github.com/kshitijd20/RSA-CVPR19-release,2
223,On zero-shot recognition of generic objects,Poster,https://github.com/TristHas/GOZ,2
224,Efficient Neural Network Compression,Poster,https://github.com/Hyeji-Kim/ENC,2
225,Actor-Critic Instance Segmentation,Poster,https://github.com/visinf/acis,1
226,Defending against adversarial attacks by randomized diversification,Poster,https://github.com/taranO/defending-adversarial-attacks-by-RD,1
227,Generative Dual Adversarial Network for Generalized Zero-shot Learning,Poster,https://github.com/stevehuanghe/GDAN,1
228,Out-of-Distribution Detection for Generalized Zero-Shot Action Recognition,Poster,https://github.com/naraysa/gzsl-od,1
229,Complete the Look: Scene-based Complementary Product Recommendation,Poster,https://github.com/kang205/STL-Dataset,1
230,Learning Not to Learn: Training Deep Neural Networks with Biased Data,Poster,https://github.com/feidfoe/learning-not-to-learn,1
231,A-CNN: Annularly Convolutional Neural Networks on Point Clouds,Poster,https://github.com/artemkomarichev/a-cnn,1
232,Meta-learning Convolutional Neural Architectures for Multi-target Concrete Defect Classification with the COncrete DEfect BRidge IMage Dataset,Poster,https://github.com/MrtnMndt/meta-learning-CODEBRIM,1
233,Unsupervised Visual Domain Adaptation: A Deep Max-Margin Gaussian Process Approach,Oral,https://github.com/seqam-lab/GPDA,0
234,MAP inference via Block-Coordinate Frank-Wolfe Algorithm,Oral,https://github.com/LPMP/LPMP,0
235,Unsupervised Deep Epipolar Flow for Stationary or Dynamic Scenes,Poster,https://github.com/yiranzhong/EPIflow.git,0
236,Detecting Overfitting of Deep Generative Networks via Latent Recovery,Poster,https://github.com/ryanwebster90/gen-overfitting-latent-recovery,0
237,Understanding the Disharmony between Dropout and Batch Normalization by Variance Shift,Poster,https://github.com/rileykwok/Food-Classification,0
238,"Isospectralization, or how to hear shape, style, and correspondence",Poster,https://github.com/lcosmo/isospectralization,0
239,Additive Adversarial Learning for Unbiased Authentication,Poster,https://github.com/langlrsw/AAL-unbiased-authentication,0
240,QATM: Quality-Aware Template Matching For Deep Learning,Poster,https://github.com/kamata1729/QATM_pytorch,0
241,DFANet: Deep Feature Aggregation for Real-Time Semantic Segmentation,Poster,https://github.com/j-a-lin/DFANet_PyTorch,0
242,Beyond Gradient Descent for Regularized Segmentation Losses,Poster,https://github.com/dmitrii-marin/adm-seg,0
243,Understanding and Visualizing Deep Visual Saliency Models,Poster,https://github.com/SenHe/uavdvsm,0
244,Exploring the Bounds of the Utility of Context for Object Detection,Poster,https://github.com/EhudBarnea/ContextAnalysis,0
245,Finding Task-Relevant Features for Few-Shot Learning by Category Traversal,Oral,,0
246,Edge-Labeling Graph Neural Network for Few-shot Learning,Oral,,0
247,Generating Classification Weights with Graph Neural Networks for Few-Shot Learning,Oral,,0
248,Why ReLu networks yield high-confidence predictions far away from the training data and how to mitigate the problem,Oral,,0
249,On the Structural Sensitivity of Deep Convolutional Networks to the Directions of Fourier Basis Functions,Oral,,0
250,Neural Rejuvenation: Improving Deep Network Training by Enhancing Computational Resource Utilization,Oral,,0
251,Learning to Learn Loss for Active Learning,Oral,,0
252,Striking the Right Balance with Uncertainty,Oral,,0
253,AutoAugment: Learning Augmentation Strategies from Data,Oral,,0
254,BAD SLAM: Bundle Adjusted Direct RGB-D SLAM,Oral,,0
255,Revealing Scenes by Inverting Structure from Motion Reconstructions,Oral,,0
256,Strand-accurate Multi-view Hair Capture,Oral,,0
257,DeepSDF: Learning Continuous Signed Distance Functionsfor Shape Representation,Oral,,0
258,Pushing the Boundaries of View Extrapolation with Multiplane Images,Oral,,0
259,LAF-Net: Locally Adaptive Fusion Networks for Stereo Confidence Estimation,Oral,,0
260,NM-Net: Mining Reliable Neighbors for Robust Feature Correspondences,Oral,,0
261,Coordinate-Free Carlsson-Weinshall Duality and Relative Multi-View Geometry,Oral,,0
262,Deep Reinforcement Learning of Volume-guided Progressive View Inpainting for 3D Point Scene Completion from a Single Depth Image,Oral,,0
263,Video Action Transformer Network,Oral,,0
264,STEP: Spatio-Temporal Progressive Learning for Video Action Detection,Oral,,0
265,Relational Action Forecasting,Oral,,0
266,Long-Term Feature Banks for Detailed Video Understanding,Oral,,0
267,Which Way Are You Going? Imitative Decision Learning for Path Forecasting in Dynamic Scenes,Oral,,0
268,What and How Well You Performed? A Multitask Approach To Action Quality Assessment,Oral,,0
269,MHP-VOS: Video Object Segmentation with Multiple Hypotheses Propagation,Oral,,0
270,Language-driven Temporal Activity Localization: A Semantic Matching Reinforcement Learning Model,Oral,,0
271,Gaussian Temporal Awareness Networks for Action Localization,Oral,,0
272,Efficient Video Classification Using Fewer Frames,Oral,,0
273,Joint Discriminative and Generative Learning for Person Re-identification,Oral,,0
274,Learning Context Graph for Person Search,Oral,,0
275,Gradient Matching Generative Networks for Zero-Shot Learning,Oral,,0
276,Doodle to Search: Practical Zero-Shot Sketch-based Image Retrieval,Oral,,0
277,Zero-Shot Task Transfer,Oral,,0
278,Learning Inter-pixel Relations for Weakly Supervised Instance Segmentation,Oral,,0
279,Attention-based Dropout Layer for Weakly Supervised Object Localization,Oral,,0
280,Transferrable Prototypical Networks for Unsupervised Domain Adaptation,Oral,,0
281,Adversarial Meta-Adaptation Network for Blending-target Domain Adaptation,Oral,,0
282,ELASTIC: Improving CNNs by Instance Specific Scaling Policies,Oral,,0
283,SFNet: Learning Object-aware Semantic Correspondence,Oral,,0
284,Deep Metric Learning Beyond Binary Supervision,Oral,,0
285,Learning to Cluster Faces on an Affinity Graph,Oral,,0
286,C2AE: Class Conditioned Auto-Encoder for Open-set Recognition,Oral,,0
287,Shapes and Context: In-the-wild Image Synthesis & Manipulation,Oral,,0
288,Semantics Disentangling for Text-to-Image Generation,Oral,,0
289,Unsupervised Person Image Generation with Semantic Parsing Transformation,Oral,,0
290,DeepView: View synthesis with learned gradient descent,Oral,,0
291,Textured Neural Avatars,Oral,,0
292,IM-Net for High Resolution Video Frame Interpolation,Oral,,0
293,Homomorphic Latent Space Interpolation for Unpaired Image-to-image Translation,Oral,,0
294,Geometry-Consistent Generative Adversarial Networks for One-Sided Unsupervised Domain Mapping,Oral,,0
295,DeepVoxels: Learning Persistent 3D Feature Embeddings,Oral,,0
296,Inverse Path Tracing for Joint Material and Lighting Estimation,Oral,,0
297,The Visual Centrifuge: Model-Free Layered Video Representations,Oral,,0
298,CollaGAN: Collaborative GAN for Missing Image Data Imputation,Oral,,0
299,d-SNE: Domain Adaptation using Stochastic Neighborhood Embedding,Oral,,0
300,Local Feature Augmentation with Cross-Modality Context,Oral,,0
301,Large-scale Long-Tailed Recognition in an Open World,Oral,,0
302,SDC - Stacked Dilated Convolution: A Unified Descriptor Network for Dense Matching Tasks,Oral,,0
303,Learning Correspondence from the Cycle-consistency of Time,Oral,,0
304,AE^2-Nets: Autoencoder in Autoencoder Networks,Oral,,0
305,Mitigating Information Leakage in Image Representations: A Maximum Entropy Approach,Oral,,0
306,Learning Spatial Common Sense with Geometry-Aware Recurrent Networks,Oral,,0
307,Structured Knowledge Distillation for Semantic Segmentation,Oral,,0
308,Towards Scene Understanding: Unsupervised Monocular Depth Estimation with Semantic-aware Representation,Oral,,0
309,Tell Me Where I Am: Object-level Scene Context Prediction,Oral,,0
310,Normalized Object Coordinate Space for Category-Level 6D Object Pose and Size Estimation,Oral,,0
311,Do Better ImageNet Models Transfer Better?,Oral,,0
312,Learning Video Representations from Correspondence Proposals,Oral,,0
313,SiamRPN++: Evolution of Siamese Visual Tracking with Very Deep Networks,Oral,,0
314,Sphere Generative Adversarial Network Based on Geometric Moment Matching,Oral,,0
315,Adversarial Attacks Beyond the Image Space,Oral,,0
316,Evading Defenses to Transferable Adversarial Examples by Translation-Invariant Attacks,Oral,,0
317,A General and Adaptive Robust Loss Function,Oral,,0
318,Learning to Quantize Deep Networks by Optimizing Quantization Intervals with Task Loss,Oral,,0
319,Not All Areas Are Equal: Transfer Learning for Semantic Segmentation via Hierarchical Region Selection,Oral,,0
320,Unsupervised Learning of Dense Shape Correspondence,Oral,,0
321,Balanced Self-Paced Learning for Generative Adversarial Clustering Network,Oral,,0
322,Parallel Optimal Transport GAN,Oral,,0
323,Causes and Corrections for Bimodal Multipath Scanning with Structured Light,Oral,,0
324,PlaneRCNN: 3D Plane Detection and Reconstruction from a Single View,Oral,,0
325,3D Shape Reconstruction from Images in the Frequency Domain,Oral,,0
326,SiCloPe: Silhouette-based Clothed People,Oral,,0
327,Convolutional Mesh Regression for Single-Image Human Shape Reconstruction,Oral,,0
328,H+O: Unified Egocentric Recognition of 3D Hand-Object Poses and Interactions,Oral,,0
329,Learning the Depths of Moving People by Watching Frozen People,Oral,,0
330,Extreme Relative Pose Estimation for RGB-D Scans via Scene Completion,Oral,,0
331,A Skeleton-bridged Deep Learning Approach for Generating Meshes of Complex Topologies from Single RGB Images,Oral,,0
332,Structure-And-Motion-Aware Rolling Shutter Correction,Oral,,0
333,PVNet: Pixel-wise Voting Network for 6DoF Pose Estimation,Oral,,0
334,Learning Optical Flow with Occlusion Hallucination,Oral,,0
335,High Fidelity Facial Performance Tracking In-the-wild,Oral,,0
336,Diverse Generation for Multi-agent Sports Games,Oral,,0
337,Efficient Online Multi-Person 2D Pose Tracking with Recurrent Spatio-Temporal Affinity Fields,Oral,,0
338,GFrames: Gradient-Based Local Reference Frame for 3D Shape Matching,Oral,,0
339,Eliminating Exposure Bias and Loss-Evaluation Mismatch in Multiple Object Tracking,Oral,,0
340,Graph Convolutional Tracking,Oral,,0
341,Visual Tracking via Adaptive Spatially-Regularized Correlation Filters,Oral,,0
342,Deep Tree Learning for Zero-shot Face Anti-Spoofing,Oral,,0
343,Learning Joint Unique-Gait and Cross-Gait Representation by Minimizing Quintuplet Loss,Oral,,0
344,Gait Recognition via Disentangled Representation Learning,Oral,,0
345,Panoptic Feature Pyramid Network,Oral,,0
346,Reasoning-RCNN: Unifying Adaptive Global Reasoning into Large-scale Object Detection,Oral,,0
347,Cross-Modality Personalization for Retrieval,Oral,,0
348,Composing Text and Image for Image Retrieval - An Empirical Odyssey,Oral,,0
349,Arbitrary Shape Scene Text Detection with Adaptive Text Region Representation,Oral,,0
350,Adaptive NMS: Refining Pedestrian Detection in a Crowd,Oral,,0
351,"Point in, Box out: Beyond Counting Persons in Crowds",Oral,,0
352,Mutual Learning of Complementary Networks via Residual Correction for Improving Semi-Supervised Classification,Oral,,0
353,Sampling Techniques for Large-Scale Object Detection from Sparsely Annotated Objects,Oral,,0
354,Barrage of Random Transforms for Adversarially Robust Defense,Oral,,0
355,LaSO: Label-Set Operations networks for multi-label few-shot learning,Oral,,0
356,Few-Shot Learning with Localization in Realistic Settings,Oral,,0
357,AdaGraph: Unifying Predictive and Continuous Domain Adaptation through Graphs,Oral,,0
358,Streamlined Dense Video Captioning,Oral,,0
359,Adversarial Inference for Multi-Sentence Video Description,Oral,,0
360,Unified Visual-Semantic Emebddings: Bridging Vision and Language with Structured Meaning Representations,Oral,,0
361,Learning to Compose Dynamic Tree Structures for Visual Contexts,Oral,,0
362,Reinforced Cross-Modal Matching and Self-Supervised Imitation Learning for Vision-Language Navigation,Oral,,0
363,Dynamic Fusion with Intra- and Inter-modality Attention Flow for Visual Question Answering,Oral,,0
364,Cycle-Consistency for Robust Visual Question Answering,Oral,,0
365,Embodied Question Answering in Photorealistic Environments with Point Cloud Perception,Oral,,0
366,Recursive Visual Attention in Visual Dialog,Oral,,0
367,Two Body Problem: Collaborative Visual Task Completion,Oral,,0
368,GQA: a new dataset for compositional question answering over real-world images,Oral,,0
369,Text2Scene: Generating Compositional Scenes from Textual Descriptions,Oral,,0
370,Learning to Learn How to Learn: Self-Adaptive Visual Navigation using Meta-Learning,Oral,,0
371,From One Photon to a Billion: High Flux Imaging with Single-Photon Sensors,Oral,,0
372,Photon-Flooded Single-Photon 3D Cameras,Oral,,0
373,Acoustic Non-Line-of-Sight Imaging,Oral,,0
374,Steady-state Non-Line-of-Sight Imaging,Oral,,0
375,A Theory of Fermat Paths for Non-Line-of-Sight Shape Reconstruction,Oral,,0
376,End-to-end Projector Photometric Compensation,Oral,,0
377,Bringing Alive Blurred Moments!,Oral,,0
378,Learning to Synthesize Motion Blur,Oral,,0
379,Underexposed Photo Enhancement using Deep Illumination Estimation,Oral,,0
380,Blind Visual Motif Removal from a Single Image,Oral,,0
381,Non-local Meets Global: An Integrated Paradigm for Hyperspectral Denoising,Oral,,0
382,Total Scene Capture: Neural Rerendering in the Wild,Oral,,0
383,GeoNet: Deep Geodesic Networks for Point Cloud Analysis,Oral,,0
384,MeshAdv: Adversarial Meshes for Visual Recognition,Oral,,0
385,Fast Spatially-Varying Indoor Lighting Estimation,Oral,,0
386,Neural Illumination: Lighting Prediction for Indoor Environments,Oral,,0
387,Deep Sky Modeling for Single Image Outdoor Lighting Estimation,Oral,,0
388,Holistic and Comprehensive Annotation of Clinically Significant Findings on Diverse CT Images: Learning from Radiology Reports and Label Ontology,Oral,,0
389,Robust Histopathology Image Analysis: to Label or to Synthesize?,Oral,,0
390,Data augmentation with spatial and appearance transforms for one-shot medical image segmentation,Oral,,0
391,Shifting More Attention to Video Salient Object Detection,Oral,,0
392,Neural Task Graphs: Generalizing to Unseen Tasks from a Single Video Demonstration,Oral,,0
393,Beyond Tracking: Selecting Memory and Refining Poses for Deep Visual Odometry,Oral,,0
394,Image Generation from Layout,Oral,,0
395,Multimodal Explanations by Predicting Counterfactuality in Videos,Oral,,0
396,Learning to Explain with Complemental Examples,Oral,,0
397,HAQ: Hardware-Aware Automated Quantization,Oral,,0
398,Inverse Procedural Modeling of Knitwear,Oral,,0
399,Estimating 3D Motion and Forces of Person-Object Interactions from Monocular Video,Oral,,0
400,DeepMapping: Unsupervised Map Estimation From Multiple Point Clouds,Oral,,0
401,End-to-end Interpretable Neural Motion Planner,Oral,,0
402,"Divergence Triangle for Joint Training of Generator Model, Energy-based Model, and Inferential Model",Oral,,0
403,IMAGE DEFORMATION META-NETWORK FOR ONE-SHOT LEARNING,Oral,,0
404,Online high-rank matrix completion,Oral,,0
405,Multispectral Imaging for Fine-Grained Recognition of Powders on Complex Backgrounds,Oral,,0
406,Robust Subspace Clustering with Independent and Piecewise Identically Distributed Noise Modeling,Oral,,0
407,What Correspondences Reveal about Unknown Camera and Motion Models?,Oral,,0
408,Self-calibrating Deep Photometric Stereo Networks,Oral,,0
409,Know Before You Go: 3D Tracking and Forecasting with Rich Maps,Oral,,0
410,Side Window Filtering,Oral,,0
411,Defense Against Adversarial Images using Web-Scale Nearest-Neighbor Search,Oral,,0
412,Incremental Object Learning from Contiguous Views,Oral,,0
413,IP102: A Large-Scale Benchmark Dataset for Insect Pest Recognition,Oral,,0
414,CityFlow: A City-Scale Benchmark for Multi-Target Multi-Camera Vehicle Tracking and Re-Identification,Oral,,0
415,Social-IQ: A Question Answering Benchmark for Open-ended Social Intelligence,Oral,,0
416,Joint Semantic-Instance Segmentation of 3D Point Clouds Using Multi-Set Label Conditional Random Fields,Oral,,0
417,Proposal-free instance segmentation with a clustering loss function,Oral,,0
418,Deep Instance Co-segmentation by Co-peak Search and Co-saliency Detection,Oral,,0
419,Improving Semantic Segmentation via Video Propagation and Label Relaxation,Oral,,0
420,Accel: A Corrective Fusion Network for Efficient Semantic Segmentation on Video,Oral,,0
421,Shape2Motion: Joint Analysis of Motion Parts and Attributes from 3D Shapes,Oral,,0
422,Semantic Correlation Promoted Shape-Variant Context for Segmentation,Oral,,0
423,Enhancing Diversity of Defocus Blur Detectors via Cross-Ensemble Network,Oral,,0
424,Collaborative Global-Local Networks for Memory-Efficient Segmentation of Ultra-high Resolution Images,Oral,,0
425,Learning Personalized Modular Network Guided by Structured Knowledge,Oral,,0
426,A Generative Appearance Model for End-to-end Video Object Segmentation,Oral,,0
427,Practical Full Resolution Learned Lossless Image Compression,Oral,,0
428,Image-to-Image Translation via Group-wise Deep Whitening and Coloring,Oral,,0
429,Max-Sliced Wasserstein Distance and its use for GANs,Oral,,0
430,Tangent-Normal Adversarial Regularization for Semi-supervised Learning,Oral,,0
431,Auto-Encoding Scene Graphs for Descriptive Image Captioning,Oral,,0
432,"Fast, Diverse and Accurate Image Captioning Guided By Part-of-Speech",Oral,,0
433,Cascaded Projection: End-to-End Network Compression and Acceleration,Oral,,0
434,DeepCaps : Going Deeper with Capsule Networks,Oral,,0
435,DNASNet: Hardware-Aware Efficient ConvNet Design via Differentiable Neural Architecture Search,Oral,,0
436,APDrawingGAN: Generating Artistic Portrait Drawings from Face Photos with Hierarchical GANs,Oral,,0
437,Constrained Generative Adversarial Networks for Interactive Image Generation,Oral,,0
438,Explainability Methods for Graph Convolutional Neural Networks,Oral,,0
439,A Generative Adversarial Density Estimator,Oral,,0
440,SoDeep: a Sorting Deep net to learn ranking loss surrogates,Oral,,0
441,High-Quality Face Capture Using Anatomical Muscles,Oral,,0
442,FML: Face Model Learning from Videos,Oral,,0
443,AdaScale: Adaptively Scaling Cosine Logits for Effectively Learning Deep Face Representations,Oral,,0
444,3D Hand Shape and Pose Estimation from a Single RGB Image,Oral,,0
445,3D hand shape and pose from images in the wild,Oral,,0
446,Self supervised 3D hand pose estimation,Oral,,0
447,Towards Social Artificial Intelligence: Nonverbal Social Signal Prediction in A Triadic Interaction,Oral,,0
448,"Synergistic, Part-Based 3D Human Reconstruction In-The-Wild",Oral,,0
449,Weakly-Supervised Discovery of Geometry-Aware Representation for 3D Human Pose Estimation,Oral,,0
450,In the Wild Human Pose Estimation using Explicit 2D Features and Intermediate 3D Representations,Oral,,0
451,DensePose-Slim: Cheaper Learning from Motion Cues,Oral,,0
452,Twin-Cycle Autoencoder: Self-supervised Representation Learning from Entangled Movement for Facial Action Unit Detection,Oral,,0
453,Combining 3D Morphable Models: A Largescale Face-and-Head Model,Oral,,0
454,Boosting Local Shape Matching for Dense 3D Face Correspondence,Oral,,0
455,Unsupervised Part-Based Disentangling of Object Shape and Appearance,Oral,,0
456,"Monocular Total Capture: Posing Face, Body, and Hands in the Wild",Oral,,0
457,"Expressive Body Capture: 3D Hands, Face, and Body from a Single Image",Oral,,0
458,Neural RGB -> D Sensing: Depth and Uncertainty from a Video Camera,Oral,,0
459,SOSNet: Second Order Similarity Regularization for Local Descriptor Learning,Oral,,0
460,“Double-DIP”: Unsupervised Image Decomposition via Coupled Deep-Image-Priors,Oral,,0
461,Unprocessing Images for Learned Raw Denoising,Oral,,0
462,Residual Networks for Light Field Image Super-Resolution,Oral,,0
463,Modulating Image Restoration with Continual Levels via Adaptive Feature Modification Layers,Oral,,0
464,Second-order Attention Network for Single Image Super-resolution,Oral,,0
465,Devil is in the Edges: Learning Semantic Boundaries from Noisy Annotations,Oral,,0
466,Path-Invariant Map Networks,Oral,,0
467,FilterReg: Robust and Efficient Probabilistic Point-Set Registration using Gaussian Filter and Twist Parameterization,Oral,,0
468,Probabilistic Permutation Synchronization using the Riemannian Structure of the Birkhoff Polytope,Oral,,0
469,Lifting Vectorial Variational Problems: A Natural Formulation based on Geometric Measure Theory and Discrete Exterior Calculus,Oral,,0
470,A Sufficient Condition for Convergences of Adam and RMSProp,Oral,,0
471,Guaranteed Matrix Completion under Multiple Linear Transformations,Oral,,0
472,A convex relaxation for multi-graph matching,Oral,,0
473,Large Scale Incremental Learning,Poster,,0
474,Structural Point Cloud Decoder,Poster,,0
475,Perceive Where to Focus: Learning Visibility-aware Part-level Features for Partial Person Re-identification,Poster,,0
476,Structured Binary Neural Networks for Accurate Image Classification and Semantic Segmentation,Poster,,0
477,Graph-Based Global Reasoning Networks,Poster,,0
478,Spherical Fractal Convolution Neural Networks for Point Cloud Recognition,Poster,,0
479,Task-Aware Synthetic Data Generation,Poster,,0
480,Divide and Conquer the Embedding Space for Metric Learning,Poster,,0
481,Attending to Discriminative Certainty for Domain Adaptation,Poster,,0
482,On Implicit Filter Level Sparsity in Convolutional Neural Networks,Poster,,0
483,FlowNet3D: Learning Scene Flow in 3D Point Clouds,Poster,,0
484,Scene Memory Transformer for Embodied Agents in Long-Horizon Tasks,Poster,,0
485,Co-occurrent Features in Semantic Segmentation,Poster,,0
486,Bag of Tricks to Train Convolutional Neural Networks for Image Classification,Poster,,0
487,Learning Channel-wise Interactions for Binary Convolutional Neural Networks,Poster,,0
488,Knowledge Translation and Adaptation for Efficient Semantic Segmentation,Poster,,0
489,Parametric Noise Injection: Trainable Randomness to Improve Deep Neural Network Robustness against Adversarial Attack,Poster,,0
490,Dissecting Person Re-identification from the Viewpoint of Viewpoint,Poster,,0
491,Learning to Reduce Dual-level Discrepancy for Infrared-Visible Person Re-identification,Poster,,0
492,Progressive Feature Alignment for Unsupervised Domain Adaptation,Poster,,0
493,Feature-level Frankenstein: Eliminating Variations for Discriminative Recognition,Poster,,0
494,Learning a Deep ConvNet for Multi-label Classification with Partial Labels,Poster,,0
495,Generalized Intersection over Union: A Metric and A Loss for Bounding Box Regression,Poster,,0
496,Densely Semantically Aligned Person Re-Identification,Poster,,0
497,Generalising Fine-Grained Sketch-Based Image Retrieval,Poster,,0
498,Adapting Object Detectors via Selective Cross-Domain Alignment,Poster,,0
499,Cyclic Guidance for Weakly Supervised Joint Detection and Segmentation,Poster,,0
500,Thinking Outside the Pool: Active Training Image Creation for Relative Attributes,Poster,,0
501,Generalizable Person Re-identification by Domain-Invariant Mapping Network,Poster,,0
502,Visual Attention Consistency under Image Transforms for Multi-label Image Classification,Poster,,0
503,Re-ranking via Metric Fusion for Object Retrieval and Person Re-identification,Poster,,0
504,Unsupervised Domain Adaptation by Semantic Discrepancy Minimization,Poster,,0
505,Weakly Supervised Person Re-Identification,Poster,,0
506,Automatic adaptation of object detectors to new domains using self-training,Poster,,0
507,Deep Sketch-Shape Hashing with Segmented 3D Stochastic Viewing,Poster,,0
508,Libra R-CNN: Balanced Learning for Object Detection,Poster,,0
509,Learning a Unified Classifier Incrementally via Rebalancing,Poster,,0
510,Feature Selective Anchor-Free Module for Single-Shot Object Detection,Poster,,0
511,Feature Distillation: DNN-Oriented JPEG Compression Against Adversarial Examples,Poster,,0
512,SCOPS: Self-Supervised Co-Part Segmentation,Poster,,0
513,Unsupervised Moving Object Detection via Contextual Information Separation,Poster,,0
514,DrivingStereo: A Large-Scale Dataset for Stereo Matching in Autonomous Driving Scenarios,Poster,,0
515,A Dataset and Benchmark for Large-scale Multi-modal Face Anti-Spoofing,Poster,,0
516,Unsupervised Learning of Consensus Maximization for 3D Vision Problems,Poster,,0
517,Detecting Private Information and Its Purpose in Pictures Taken by Blind People,Poster,,0
518,Structural Relational Reasoning of Point Clouds,Poster,,0
519,Morphable Model-based Multi-view 3D Face Reconstruction with Convolutional Neural Networks,Poster,,0
520,Guided Stereo Matching,Poster,,0
