,name,presentation type,github link,stars
834,On the Continuity of Rotation Representation in Neural Networks,Poster,,0
835,Iterative Residual Refinement for Joint Optical Flow and Occlusion Estimation,Poster,,0
836,Inverse Discriminative Networks for Handwritten Signature Verification,Poster,,0
837,Led3D: A Lightweight and Efficient Deep Approach to Recognizing Low-quality 3D Faces,Poster,,0
838,ROI Pooled Correlation Filters for Visual Tracking,Poster,,0
839,Deep Video Inpainting,Poster,,0
840,DM-GAN: Dynamic Memory Generative Adversarial Networks for Text-to-image Synthesis,Poster,,0
841,Non-Adversarial Image Synthesis with Generative Latent Nearest Neighbors,Poster,,0
842,Mixture Density Generative Adversarial Networks,Poster,,0
843,SketchGAN: Joint Sketch Completion and Recognition with Generative Adversarial Network,Poster,,0
844,Foreground-aware Image Inpainting,Poster,,0
845,Structure-Preserving Stereoscopic View Synthesis with Multi-Scale Adversarial Correlation Matching,Poster,,0
846,DynTypo: Example-based Dynamic Text Effects Transfer,Poster,,0
847,Arbitrary Style Transfer with Style-Attentional Network​s,Poster,,0
848,Typography with Decor: Intelligent Text Style Transfer,Poster,,0
849,RL-GAN-Net: A Reinforcement Learning Agent Controlled GAN Network for Real-Time Point Cloud Shape Completion,Poster,,0
850,Photo Wake-Up: 3D Character Animation from a Single Photo,Poster,,0
851,Learning to Light for Mobile Mixed Reality in Unconstrained Environments,Poster,,0
852,An Iterative and Cooperative Top-down and Bottom-up Inference Network for Salient Object Detection,Poster,,0
853,Deep Stacked Hierarchical Multi-Patch Network for Image Deblurring,Poster,,0
854,Turn a Silicon Camera into an InGaAs Camera,Poster,,0
855,Low-rank Tensor Completion with a New Tensor Nuclear Norm Induced by Invertible Linear Transforms,Poster,,0
856,Joint Representative Selection and Feature Learning: A Semi-Supervised Approach,Poster,,0
857,The Domain Transform Solver,Poster,,0
858,CapSal: Leveraging Captioning to Boost Semantics for Salient Object Detection,Poster,,0
859,Phase-only Image Based Kernel Estimation for Single-image Blind Deblurring,Poster,,0
860,FOCNet: A Fractional Optimal Control Network for Image Denoising,Poster,,0
861,Orthogonal Decomposition Network for Pixel-wise Binary Classification,Poster,,0
862,ComDefend: An Efficient Image Compression Model to Defend Adversarial Examples,Poster,,0
863,Combinatorial persistency criteria for multicut and max-cut,Poster,,0
864,S4Net: Single Stage Salient-Instance Segmentation,Poster,,0
865,A Decomposition Algorithm for the Sparse Generalized Eigenvalue Problem,Poster,,0
866,Polynomial Representation for Persistence Diagram,Poster,,0
867,Crowd Counting and Density Estimation by Trellis Encoder-Decoder Network,Poster,,0
868,Cross-atlas Convolution for Parameterization Invariant Learning on Textured Mesh Surface,Poster,,0
869,Deep Surface Normal Estimation with Hierarchical RGB-D Fusion,Poster,,0
870,An End-to-end Network for Panoptic Segmentation,Poster,,0
871,Fast and Flexible Indoor Scene Synthesis with Deep Convolutional Generative Models,Poster,,0
872,Marginalized Latent Semantic Encoder for Zero-Shot Learning,Poster,,0
873,Unsupervised Embedding Learning Using Invariant and Spreading Instance Feature,Poster,,0
874,Learning Deep Compositional Grammatical Architectures for Visual Recognition,Poster,,0
875,A Robust Local Spectral Descriptor for Matching Non-Rigid Shapes with Incompatible Shape Structures,Poster,,0
876,Context and Attribute Grounded Dense Captioning,Poster,,0
877,Spot and Learn: A Maximum-Entropy Image Patch Sampler for Few-Shot Classification,Poster,,0
878,Interpreting CNNs via Explanatory Trees,Poster,,0
879,Dense Relational Captioning: Triple-Stream Networks for Relationship-Based Captioning,Poster,,0
880,Deep Modular Co-Attention Networks for Visual Question Answering,Poster,,0
881,Synthesizing Environment-Aware Activities via Activity Sketches,Poster,,0
882,"Show, Control and Tell: A Framework for Generating Grounded and Controllable Captions",Poster,,0
883,Multi-target Embodied Question Answering,Poster,,0
884,Visual question answering as reading comprehension,Poster,,0
885,StoryGAN: A Sequential Conditional GAN for Story Visualization,Poster,,0
886,Versatile Multiple Choice Learning and Its Application to Vision Computing,Poster,,0
887,EV-Gait: Event-based Robust Gait Recognition using Dynamic Vision Sensors,Poster,,0
888,Deep Supervised Automatic Tooth Instance Segmentation and Identification from Cone Beam Computed Tomography Images,Poster,,0
889,Modularized Textual Grounding for Counterfactual Resilience,Poster,,0
890,L3-Net: Towards Learning based LiDAR Localization for Autonomous Driving,Poster,,0
891,Enhanced Bayesian Compression via Deep Reinforcement Learning,Poster,,0
892,MFAS: Multimodal Fusion Architecture Search,Poster,,0
893,Disentangling Adversarial Robustness and Generalization,Poster,,0
894,ShieldNets: Defending Against Adversarial Attacks using Policy Gradient Reinforcement Learning,Poster,,0
895,Deeply-Supervised Knowledge Synergy,Poster,,0
896,Probabilistic End-to-end Noise Correction for Learning with Noisy Labels,Poster,,0
897,Attention-guided Unified Network for Panoptic Segmentation,Poster,,0
898,NAS-FPN: Learning Scalable Feature Pyramid Architecture for Object Detection,Poster,,0
899,OICSR: Out-In-Channel Sparsity Regularization for Compact Deep Neural Networks,Poster,,0
900,Semantically Aligned Bias Reducing Zero Shot Learning,Poster,,0
901,Feature Space Perturbations Yield More Transferable Adversarial Examples,Poster,,0
902,IGE-Net: Inverse Graphics Energy Networks\\for Human Pose Estimation and Single-View Reconstruction,Poster,,0
903,Accelerating Convolutional Neural Networks via Activation Map Compression,Poster,,0
904,Knowledge Distillation via Instance Relationship Graph,Poster,,0
905,Building Detail-Sensitive Semantic Segmentation Networks with Polynomial Pooling,Poster,,0
906,Variational Bayesian Dropout,Poster,,0
907,AANet: Attribute Attentio Network for Person Re-Identification,Poster,,0
908,Overcoming Limitations of Mixture Density Networks: A Sampling and Fitting Framework for Multimodal Future Prediction,Poster,,0
909,A Main/Subsidiary Network Framework for Simplifying Binary Neural Networks,Poster,,0
910,Few Shot Adaptive Faster R-CNN,Poster,,0
911,VRSTC: Occlusion-Free Video Person Re-Identification,Poster,,0
912,Compact Feature Learning for Multi-domain Image Classification,Poster,,0
913,Adaptive Transfer Network for Cross-Domain Person Re-Identification,Poster,,0
914,Large-Scale Few-Shot Learning: Knowledge Transfer with Class Hierarchy,Poster,,0
915,Moving Object Detection under Discontinuous Change in Illumination Using Tensor Low-Rank and Invariant Sparse Decomposition,Poster,,0
916,Pedestrian Detection with Autoregressive Network Phases,Poster,,0
917,All You Need is a Few Shifts: Designing Efficient Convolutional Neural Networks for Image Classification,Poster,,0
918,Stochastic Class-based Hard Example Mining for Deep Metric Learning,Poster,,0
919,Revisiting Local Descriptor based Image-to-Class Measure for Few-shot Learning,Poster,,0
920,Towards Robust Curve Text Detection with Conditional Spatial Expansion,Poster,,0
921,Revisiting Perspective Information for Efficient Crowd Counting,Poster,,0
922,Towards Universal Object Detection by Domain Attention,Poster,,0
923,Ensemble Deep Manifold Similarity Learning using Hard Proxies,Poster,,0
924,Quantization Networks,Poster,,0
925,RES-PCA: A Scalable Approach to Recovering Low-rank Matrices,Poster,,0
926,Occlusion-Net: 2D/3D Occluded Keypoint Localization Using Graph Networks,Poster,,0
927,Efficient Featurized Image Pyramid Network for Single Shot Detector,Poster,,0
928,Multi-Task Multi-Sensor Fusion for 3D Object Detection,Poster,,0
929,Domain Specific Batch Normalization for Unsupervised Domain Adaptation,Poster,,0
930,Grid R-CNN,Poster,,0
931,MetaCleaner: Learning to Hallucinate Clean Representations for Noisy-Labeled Visual Recognition,Poster,,0
932,Image-based Navigation using Visual Features and Map,Poster,,0
933,Triply Supervised Decoder Networks for Joint Detection and Segmentation,Poster,,0
934,DARNet: Deep Active Ray Network for Building Segmentation,Poster,,0
935,Point Cloud Oversegmentation with Graph-Structured Deep Metric Learning,Poster,,0
936,Graphonomy: Universal Human Parsing via Graph Transfer Learning,Poster,,0
937,Multiple Heterogeneous Models Fitting by Multi-class Cascaded T-linkage,Poster,,0
938,A Late Fusion CNN for Digital Matting,Poster,,0
939,BASNet: Boundary Aware Salient Object Detection,Poster,,0
940,ZigZagNet: Fusing Top-Down and Bottom-Up Context for Object Segmentation,Poster,,0
941,Object Instance Annotation with Deep Extreme Level Set Evolution,Poster,,0
942,Leveraging Crowdsourced GPS Data for Road Extraction from Aerial Imagery,Poster,,0
943,Adaptive Pyramid Context Network for Semantic Segmentation,Poster,,0
944,Speech2Face: Learning the Face Behind a Voice,Poster,,0
945,Joint manifold diffusion for combining predictions on decoupled observations,Poster,,0
946,Audio-Visual Scene-Aware Dialog,Poster,,0
947,Learning to Minify Photometric Stereo,Poster,,0
948,Reflective and Fluorescent Separation under Narrow-Band Illumination,Poster,,0
949,Depth from a polarisation + RGB stereo pair,Poster,,0
950,Rethinking the Evaluation of Video Summaries,Poster,,0
951,What Object Should I Use? - Task Driven Object Detection,Poster,,0
952,Triangulation Learning Network: from Monocular to Stereo 3D Object Detection,Poster,,0
953,Connecting the Dots: Learning Representations for Active Monocular Depth Estimation,Poster,,0
954,Learning Non-Volumetric Depth Fusion using Successive Reprojections,Poster,,0
955,Hybrid Scene Compression for Visual Localization,Poster,,0
956,MMFace: A Multi-Metric Regression Network for Unconstrained Face Reconstruction,Poster,,0
957,3D Motion Decomposition for RGBD Future Dynamic Scene Synthesis,Poster,,0
958,Visual Localization by Learning Objects-of-Interest Dense Match Regression,Poster,,0
959,RGBD Based Dimensional Decomposition Residual Network for 3D Semantic Scene Completion,Poster,,0
960,Neural Scene Decomposition for Human Motion Capture,Poster,,0
961,Efficient Decision-based Black-box Adversarial Attacks on Face Recognition,Poster,,0
962,FA-RPN: Floating Region Proposals for Face Detection,Poster,,0
963,Bayesian Hierarchical Dynamic Model for Human Action Recognition,Poster,,0
964,Mixed Effects Convolutional Neural Networks (MeNets) with Applications to Gaze Estimation,Poster,,0
965,Semantic Component Decomposition for Face Attribute Manipulation,Poster,,0
966,RepNet: Weakly Supervised Training of an Adversarial Reprojection Network for 3D Human Pose Estimation,Poster,,0
967,Fast and Robust Multi-Person 3D Pose Estimation from Multiple Views,Poster,,0
968,Face-Focused Cross-Stream Network for Deception Detection in Videos,Poster,,0
969,Unequal-training for deep face recognition with long-tailed noisy data,Poster,,0
970,T-Net: High-Order Tensor FCN,Poster,,0
971,Hierarchical Cross-modal Talking Face Generation with Dynamic Pixel-wise Loss,Poster,,0
972,Object-centric Auto-encoders and Dummy Anomalies for Abnormal Event Detection in Video,Poster,,0
973,DDLSTM: Dual-Domain LSTM for Cross-Dataset Action Recognition,Poster,,0
974,Collaborative Spatiotemporal Feature Learning for Video Action Recognition,Poster,,0
975,MARS: Motion-Augmented RGB Stream for Action Recognition,Poster,,0
976,Convolutional Relational Machine for Group Activity Recognition,Poster,,0
977,Video Summarization by Learning from Unpaired Data,Poster,,0
978,Skeleton-Based Action Recognition with Directed Graph Neural Networks,Poster,,0
979,PA3D: Pose-Action 3D Machine for Video Recognition,Poster,,0
980,Deep Dual Relation Modeling for Egocentric Interaction Recognition,Poster,,0
981,MOTS: Multi-Object Tracking and Segmentation,Poster,,0
982,Siamese Cascaded Region Proposal Networks for Real-Time Visual Tracking,Poster,,0
983,PointFlowNet: Learning Representations for Rigid Motion Estimation from Point Clouds,Poster,,0
984,Listen to the Image,Poster,,0
985,Conditional Adversarial Generative Flow for Controllable Image Synthesis,Poster,,0
986,How to make a pizza: Learning a compositional layer-based GAN model,Poster,,0
987,Geometry-Aware Unsupervised Image-to-Image Translation,Poster,,0
988,Depth-attentional Features for Single-image Rain Removal,Poster,,0
989,Hyperspectral Image Reconstruction using a Spectral Regularization Prior,Poster,,0
990,Deep Exemplar-based Video Colorization,Poster,,0
991,On Finding Gray Pixel,Poster,,0
992,UnOS: Unified Unsupervised Optical-flow and Stereo-depth Estimation by Watching Videos,Poster,,0
993,D2-Net: A Trainable CNN for Joint Description and Detection of Local Features,Poster,,0
994,Recurrent Neural Networks with Intra-Frame Iterations for Video Deblurring,Poster,,0
995,Learning to Extract Flawless Slow Motion from Blurry Videos,Poster,,0
996,Natural and Realistic Single Image Super-Resolution with Explicit Natural Manifold Discrimination,Poster,,0
997,RF-Net: An End-to-End Image Matching Network based on Receptive Field,Poster,,0
998,A Mutual Learning Method for Salient Object Detection with intertwined Multi-Supervision,Poster,,0
999,Enhanced Pix2pix Dehazing Network,Poster,,0
1000,Assessing Personally Perceived Image Quality via Image Features and Collaborative Filtering,Poster,,0
1001,Exploring Context and Visual Pattern of Relationship for Scene Graph Generation,Poster,,0
1002,Learning from Synthetic Data for Crowd Counting in the Wild,Poster,,0
1003,A Local Block Coordinate Descent Algorithm for the CSC Model,Poster,,0
1004,Not Using the Car to See the Sidewalk: Quantifying and Controlling the Effects of Context in Classification and Segmentation,Poster,,0
1005,Discovering Interpretable Fair Representations,Poster,,0
1006,SPNet: Semantic Projection Network for Zero-Label and Few-Label Semantic Segmentation,Poster,,0
1007,GCAN: Graph Convolutional Adversarial Network for Unsupervised Domain Adaptation,Poster,,0
1008,Seamless Scene Segmentation,Poster,,0
1009,Unsupervised Image Matching and Object Discovery as Optimization,Poster,,0
1010,Wide-Area Crowd Counting via Ground-Plane Density Maps and Multi-View Fusion CNNs,Poster,,0
1011,Self-critical n-step Training for Image Captioning,Poster,,0
1012,Towards VQA models that can read,Poster,,0
1013,Object-aware Aggregation with Bidirectional Temporal Graph for Video Captioning,Poster,,0
1014,Progressive Attention Memory Network for Movie Story Question Answering,Poster,,0
1015,Memory-Attended Recurrent Network for Video Captioning,Poster,,0
1016,Visual Query Answering by Entity-attribute Graph Matching and Reasoning,Poster,,0
1017,Look Back and Predict Forward in Image Captioning,Poster,,0
1018,Intention Oriented Image Captions with Guiding Objects,Poster,,0
1019,Uncertainty Guided Multi-Scale Residual Learning-using a Cycle Spinning CNN for Single Image De-Raining,Poster,,0
1020,Toward Realistic Image Composition with Adversarial Training,Poster,,0
1021,Cross-Classification Clustering: An Efficient Multi-Object Tracking Technique for 3-D Instance Segmentation in Connectomics,Poster,,0
1022,Deep ChArUco: Dark ChArUco Marker Pose Estimation,Poster,,0
1023,Rules of the Road: Predicting Driving Behavior with a Convolutional Model of Semantic Interactions,Poster,,0
1024,Metric Learning for Image Registration,Poster,,0
1025,LO-Net: Deep Real-time Lidar Odometry,Poster,,0
1026,TraPHic: Trajectory Prediction in Dense and Heterogeneous Traffic Using Weighted Interactions,Poster,,0
1027,World from Blur,Poster,,0
1028,Topology Reconstruction of Tree-like Structure in Images via Structural Similarity Measure and Dominant Set Clustering,Poster,,0
1029,Pyramidal Person Re-IDentification via Multi-Loss Dynamic Training,Poster,,0
1030,A Flexible Convolutional Solver for Fast Style Transfers,Poster,,0
1031,Cross Domain Model Compression by Structured Weight Sharing,Poster,,0
1032,TraVeLGAN: Image-to-image Translation by Transformation Vector Learning,Poster,,0
1033,Deep Robust Subjective Visual Property Prediction in Crowdsourcing,Poster,,0
1034,Transferable AutoML by Model Sharing over Grouped Datasets,Poster,,0
1035,IRLAS: Inverse Reinforcement Learning for Architecture Search,Poster,,0
1036,Learning for Single-Shot Confidence Calibration in Deep Neural Networks through Stochastic Inferences,Poster,,0
1037,Fully Learnable Group Convolution for Acceleration of Deep Neural Networks,Poster,,0
1038,EIGEN: Ecologically-Inspired GENetic Approach for Neural Network Structure Searching from Scratch,Poster,,0
1039,Deep Incremental Hashing Network for Efficient Image Retrieval,Poster,,0
1040,"Robustness via curvature regularization, and vice versa",Poster,,0
1041,Interpretable and Fine-Grained Visual Explanations for Convolutional Neural Networks,Poster,,0
1042,Structured Pruning of Neural Networks with Budget-Aware Regularization,Poster,,0
1043,MBS: Macroblock Scaling for CNN Model Reduction,Poster,,0
1044,Fast Neural Architecture Search of Compact Semantic Segmentation Models via Auxiliary Cells,Poster,,0
1045,Generating 3D Adversarial Point Clouds,Poster,,0
1046,Variational Information Distillation for Knowledge Transfer,Poster,,0
1047,GaterNet: Dynamic Filter Selection in Convolutional Neural Network via a Dedicated Global Gating Network,Poster,,0
1048,SpherePHD: Applying CNNs on a Spherical PolyHeDron Representation of 360◦ Images,Poster,,0
1049,Assisted Excitation of Activations: A Learning Technique to Improve Object Detectors,Poster,,0
1050,Exploiting Edge Features in Graph Neural Networks,Poster,,0
1051,Propagation Mechanism for Deep and Wide Neural Networks,Poster,,0
1052,"Catastrophic Child's Play: Easy to Perform, Hard to Defend Adversarial Attacks",Poster,,0
1053,Embedding Complementary Deep Networks for Image Classification,Poster,,0
1054,Deep Multimodal Clustering for Unsupervised Audiovisual Learning,Poster,,0
1055,Dense Classification and Implanting for Few-shot Learning,Poster,,0
1056,Discovering Visual Patterns in Art Collections with Spatially-consistent Feature Learning,Poster,,0
1057,Min-Max Statistical Alignment for Transfer Learning,Poster,,0
1058,Spatial-aware Graph Relation Network for Large-scale Object Detection,Poster,,0
1059,Interaction-and-Aggregation Network for Person Re-identification,Poster,,0
1060,Rare Event Detection using Disentangled Representation Learning,Poster,,0
1061,Dual Dense Encoding for Zero-Example Video Retrieval,Poster,,0
1062,MaxpoolNMS: Getting Rid of NMS Bottlenecks in Two-Stage Object Detectors,Poster,,0
1063,Character Region Awareness for Text Detection,Poster,,0
1064,Effective Aesthetics Prediction with Multi-level Spatially Pooled Features,Poster,,0
1065,Attentive Region Embedding Network for Zero-shot Learning,Poster,,0
1066,Explicit Spatial Encoding for Deep Local Descriptors,Poster,,0
1067,You reap what you sow: Generating High Precision Object Proposals for Weakly-supervised Object Detection,Poster,,0
1068,Explore-Exploit Graph Traversal for Image Retrieval,Poster,,0
1069,Dissimilarity Coefficient based Weakly Supervised Object Detection,Poster,,0
1070,Kernel Transformer Networks for Compact Spherical Convolution,Poster,,0
1071,Object detection with location-aware deformable convolution and backward attention filtering,Poster,,0
1072,Unsupervised Domain Adaptation using Feature-Whitening and Consensus Loss,Poster,,0
1073,FEELVOS: Fast End-to-End Embedding Learning for Video Object Segmentation,Poster,,0
1074,PartNet: A Recursive Part Decomposition Network for Hierarchical Segmentation of 3D Shapes,Poster,,0
1075,Learning Multi-Class Segmentations From Single-Class Datasets,Poster,,0
1076,Convolutional Recurrent Network for Road Boundary Extraction,Poster,,0
1077,ManTra-Net: Manipulation Tracing Network For Detection And Localization ofImage Forgeries With Anomalous Features,Poster,,0
1078,Explicit Bias Discovery in Visual Question Answering Models,Poster,,0
1079,A Comprehensive Real-World Dataset for Unsupervised Anomaly Detection,Poster,,0
1080,Octree guided CNN with Spherical Kernels for 3D Point Clouds,Poster,,0
1081,VITAMIN-E: VIsual Tracking And MappINg with Extremely Dense Feature Points,Poster,,0
1082,3D Appearance Super-Resolution with Deep Learning,Poster,,0
1083,Radial Distortion Triangulation,Poster,,0
1084,Robust Point Cloud Reconstruction of Large-Scale Outdoor Scenes,Poster,,0
1085,Minimal Solvers for Mini-Loop Closures in 3D Multi-Scan Alignment,Poster,,0
1086,Volumetric Capture of Humans with a Single RGBD Camera via Semi-Parametric Learning,Poster,,0
1087,Joint Face Detection and Facial Motion Retargeting for Multiple Faces,Poster,,0
1088,Monocular Depth Estimation Using Relative Depth Maps,Poster,,0
1089,Unsupervised Primitive Discovery for Improved 3D Generative Modeling,Poster,,0
1090,Learning to Explore Intrinsic Saliency for Stereoscopic Video,Poster,,0
1091,Refine and Distill: Exploiting Cycle-Inconsistency and Knowledge Distillation for Unsupervised Monocular Depth Estimation,Poster,,0
1092,Learning View Priors for Single-view 3D Reconstruction,Poster,,0
1093,3D Guided Fine-Grained Face Manipulation,Poster,,0
1094,Neuro-inspired Eye Tracking with Eye Movement Dynamics,Poster,,0
1095,Facial Emotion Distribution Learning by Exploiting Low-Rank Label Correlations Locally,Poster,,0
1096,Unsupervised Face Normalization with Extreme Pose and Expression in the Wild,Poster,,0
1097,Learning to Regress 3D Face Shape and Expression from an Image without 3D Supervision,Poster,,0
1098,R3 Adversarial Network for Cross Model Face Recognition,Poster,,0
1099,Disentangling Latent Hands for Image Synthesis and Pose Estimation,Poster,,0
1100,CrossInfoNet: Multi-Task Information Sharing Based Hand Pose Estimation,Poster,,0
1101,P2SGrad: Refined Gradients for Optimizing Deep Face Models,Poster,,0
1102,Action Recognition from Single Timestamp Supervision in Untrimmed Videos,Poster,,0
1103,Time-Conditioned Action Anticipation in One Shot,Poster,,0
1104,Representation Flow for Action Recognition,Poster,,0
1105,LSTA: Long Short-Term Attention for Egocentric Action Recognition,Poster,,0
1106,Learning Actor Relation Graphs for Group Activity Recognition,Poster,,0
1107,A Structured Model For Action Detection,Poster,,0
1108,Object Discovery in Videos as Foreground Motion Clustering,Poster,,0
1109,Towards Natural and Accurate Future Motion Prediction of Humans and Animals,Poster,,0
1110,Automatic Face Aging in Videos via Deep Reinforcement Learning,Poster,,0
1111,Multi-adversarial Discriminative Deep Domain Generalization for Face Presentation Attack Detection,Poster,,0
1112,Using a Transformation Content Block For Image Style Transfer,Poster,,0
1113,BeautyGlow: On-Demand Makeup Transfer Framework with Reversible Generative Network,Poster,,0
1114,Inserting Videos into Videos,Poster,,0
1115,Learning Image and Video Compression through Spatial-Temporal Energy Compaction,Poster,,0
1116,Event-based High Dynamic Range Image and Very High Frame Rate Video Generation using Conditional Generative Adversarial Networks,Poster,,0
1117,Enhancing TripleGAN for Semi-Supervised Conditional Instance Synthesis and Classification,Poster,,0
1118,"Capture, Learning, and Synthesis of 3D Speaking Styles",Poster,,0
1119,Ray-Space Projection Model for Light Field Camera,Poster,,0
1120,Deep Geometric Prior for Surface Reconstruction,Poster,,0
1121,Analysis of Feature Visibility in Non-Line-of-Sight Measurements,Poster,,0
1122,Hyperspectral Imaging with Random Printed Mask,Poster,,0
1123,All-Weather Deep Outdoor Lighting Estimation,Poster,,0
1124,A variational EM framework with adaptive edge selection for blind motion deblurring,Poster,,0
1125,Viewport Proposal CNN for 360° Video Quality Assessment,Poster,,0
1126,MAGSAC: marginalizing sample consensus,Poster,,0
1127,Divergence Prior and Vessel-tree Reconstruction,Poster,,0
1128,Unsupervised Domain-Specific Deblurring via Disentangled Representations,Poster,,0
1129,Douglas-Rachford Networks: Learning Both the Image Prior and Data Fidelity Terms for Blind Image Deconvolution,Poster,,0
1130,Speed Invariant Time Surface for Learning to Detect Corner Points with Event-Based Cameras,Poster,,0
1131,Training deep learning based image denoisers from undersampled measurements without ground truth and without image prior,Poster,,0
1132,A Variational Pan-Sharpening with Local Gradient Constraints,Poster,,0
1133,f-VAEGAN-D2: A Feature Generating Framework for Any-Shot Learning,Poster,,0
1134,Sliced Wasserstein Discrepancy for Unsupervised Domain Adaptation,Poster,,0
1135,Graph Attention Convolution for Point Cloud Segmentation,Poster,,0
1136,Normalized Diversification,Poster,,0
1137,Learning to Localize through Compressed Binary Maps,Poster,,0
1138,A Parametric Top-View Representation of Complex Road Scenes,Poster,,0
1139,Self-supervised Spatiotemporal Learning via Video Clip Order Prediction,Poster,,0
1140,Unsupervised Disentangling of Appearance and Geometry by Deformable Generator Network,Poster,,0
1141,Unsupervised Representation Learning by Rotation Feature Decoupling,Poster,,0
1142,Improved Road Connectivity by Joint Learning of Orientation and Segmentation,Poster,,0
1143,Deep Supervised Cross-modal Retrieval,Poster,,0
1144,A Theoretically Sound Upper Bound on the Triplet Loss for Improving the Efficiency of Deep Distance Metric Learning,Poster,,0
1145,Data Representation and Learning with Graph Diffusion-Embedding Networks,Poster,,0
1146,Image-Question-Answer Synergistic Network for Visual Dialog,Poster,,0
1147,Not All Frames Are Equal: Weakly-Supervised Video Grounding with Contextual Similarity and Visual Clustering Losses,Poster,,0
1148,Inverse Cooking: Recipe Generation from Food Images,Poster,,0
1149,Adversarial Semantic Alignment for Improved Image Captions,Poster,,0
1150,Answer Them All: Toward a Universal VQA Model,Poster,,0
