,title,stars,github,Oral day,Oral session,Oral time,Poster day,Poster session,Poster #,First author
514,CollaGAN: Collaborative GAN for Missing Image Data Imputation,,,Tuesday,Oral 1.2B,15:10,Tuesday,Poster 1.2,135,Dongwook Lee
515,Semantics Disentangling for Text-To-Image Generation,,,Tuesday,Oral 1.2B,13:35,Tuesday,Poster 1.2,119,Guojun Yin
516,Two Body Problem: Collaborative Visual Task Completion,,,Wednesday,Oral 2.2B,14:34,Wednesday,Poster 2.2,188,Unnat Jain
517,3D Shape Reconstruction From Images in the Frequency Domain,,,Wednesday,Oral 2.1B,08:58,Wednesday,Poster 2.1,111,Weichao Shen
518,Normalized Object Coordinate Space for Category-Level 6D Object Pose and Size Estimation,,,Tuesday,Oral 1.2C,15:00,Tuesday,Poster 1.2,181,He Wang
519,Fast Spatially-Varying Indoor Lighting Estimation,,,Wednesday,Oral 2.2C,15:00,Wednesday,Poster 2.2,145,Mathieu Garon
520,Steady-State Non-Line-Of-Sight Imaging,,,Wednesday,Oral 2.2C,13:48,Wednesday,Poster 2.2,133,Wenzheng Chen
521,Attention-Based Dropout Layer for Weakly Supervised Object Localization,,,Tuesday,Oral 1.2A,14:16,Tuesday,Poster 1.2,26,Junsuk Choe
522,SFNet: Learning Object-Aware Semantic Correspondence,,,Tuesday,Oral 1.2A,14:52,Tuesday,Poster 1.2,32,Junghyup Lee
523,Geometry-Consistent Generative Adversarial Networks for One-Sided Unsupervised Domain Mapping,,,Tuesday,Oral 1.2B,14:34,Tuesday,Poster 1.2,129,Huan Fu
524,Gradient Matching Generative Networks for Zero-Shot Learning,,,Tuesday,Oral 1.2A,13:48,Tuesday,Poster 1.2,21,Mert Bulent Sariyildiz
525,Self-Calibrating Deep Photometric Stereo Networks,,,Thursday,Oral 3.1B,09:11,Thursday,Poster 3.1,84,Guanying Chen
526,Finding Task-Relevant Features for Few-Shot Learning by Category Traversal,,,Tuesday,Oral 1.1A,09:00,Tuesday,Poster 1.1,1,Hongyang Li
527,Look Back and Predict Forward in Image Captioning,,,,,,Wednesday,Poster 2.2,201,Yu Qin
528,Assisted Excitation of Activations: A Learning Technique to Improve Object Detectors,,,,,,Thursday,Poster 3.1,26,Mohammad Mahdi Derakhshani
529,Group Sampling for Scale Invariant Face Detection,,,,,,Tuesday,Poster 1.2,97,Xiang Ming
530,Modeling Local Geometric Structure of 3D Point Clouds Using Geo-CNN,,,,,,Tuesday,Poster 1.1,89,Shiyi Lan
531,Domain-Specific Batch Normalization for Unsupervised Domain Adaptation,,,,,,Wednesday,Poster 2.2,62,Woong-Gi Chang
532,Radial Distortion Triangulation,,,,,,Thursday,Poster 3.1,105,Zuzana Kukelova
533,Polarimetric Camera Calibration Using an LCD Monitor,,,,,,Tuesday,Poster 1.2,145,Zhixiang Wang
534,Disentangling Latent Space for VAE by Label Relevant/Irrelevant Dimensions,,,,,,Thursday,Poster 3.2,142,Zhilin Zheng
535,Towards High-Fidelity Nonlinear 3D Face Morphable Model,,,,,,Tuesday,Poster 1.1,102,Luan Tran
536,Towards Instance-Level Image-To-Image Translation,,,,,,Tuesday,Poster 1.2,139,Zhiqiang Shen
537,Structure-Preserving Stereoscopic View Synthesis With Multi-Scale Adversarial Correlation Matching,,,,,,Wednesday,Poster 2.1,162,Yu Zhang
538,Libra R-CNN: Towards Balanced Learning for Object Detection,,,,,,Tuesday,Poster 1.1,59,Jiangmiao Pang
539,Occlusion-Net: 2D/3D Occluded Keypoint Localization Using Graph Networks,,,,,,Wednesday,Poster 2.2,59,N. Dinesh Reddy
540,Semantic Projection Network for Zero- and Few-Label Semantic Segmentation,,,,,,Wednesday,Poster 2.2,172,Yongqin Xian
541,Co-Occurrence Neural Network,,,,,,Wednesday,Poster 2.1,24,Irina Shevlev
542,Learning to Film From Professional Human Motion Videos,,,,,,Tuesday,Poster 1.2,214,Chong Huang
543,Depth-Attentional Features for Single-Image Rain Removal,,,,,,Wednesday,Poster 2.2,148,Xiaowei Hu
544,Stochastic Class-Based Hard Example Mining for Deep Metric Learning,,,,,,Wednesday,Poster 2.2,51,Yumin Suh
545,Modularized Textual Grounding for Counterfactual Resilience,,,,,,Wednesday,Poster 2.1,215,Zhiyuan Fang
546,Improving Few-Shot User-Specific Gaze Adaptation via Gaze Redirection Synthesis,,,,,,Thursday,Poster 3.2,116,Yu Yu
547,Global Second-Order Pooling Convolutional Networks,,,,,,Tuesday,Poster 1.2,55,Zilin Gao
548,Structured Binary Neural Networks for Accurate Image Classification and Semantic Segmentation,,,,,,Tuesday,Poster 1.1,18,Bohan Zhuang
549,Revisiting Perspective Information for Efficient Crowd Counting,,,,,,Wednesday,Poster 2.2,54,Miaojing Shi
550,Spectral Reconstruction From Dispersive Blur: A Novel Light Efficient Spectral Imager,,,,,,Thursday,Poster 3.2,143,Yuanyuan Zhao
551,Joint Face Detection and Facial Motion Retargeting for Multiple Faces,,,,,,Thursday,Poster 3.1,109,Bindita Chaudhuri
552,Character Region Awareness for Text Detection,,,,,,Thursday,Poster 3.1,43,Youngmin Baek
553,Perturbation Analysis of the 8-Point Algorithm: A Case Study for Wide FoV Cameras,,,,,,Thursday,Poster 3.2,80,Thiago L. T. da Silveira
554,R2GAN: Cross-Modal Recipe Retrieval With Generative Adversarial Network,,,,,,Thursday,Poster 3.2,51,Bin Zhu
555,Predicting Visible Image Differences Under Varying Display Brightness and Viewing Distance,,,,,,Wednesday,Poster 2.1,89,Nanyang Ye
556,Local Detection of Stereo Occlusion Boundaries,,,,,,Tuesday,Poster 1.2,153,Jialiang Wang
557,Attribute-Driven Feature Disentangling and Temporal Aggregation for Video Person Re-Identification,,,,,,Wednesday,Poster 2.1,36,Yiru Zhao
558,NAS-FPN: Learning Scalable Feature Pyramid Architecture for Object Detection,,,,,,Wednesday,Poster 2.2,11,Golnaz Ghiasi
559,Local Relationship Learning With Person-Specific Shape Regularization for Facial Action Unit Detection,,,,,,Thursday,Poster 3.2,114,Xuesong Niu
560,SimulCap : Single-View Human Performance Capture With Cloth Simulation,,,,,,Wednesday,Poster 2.1,96,Tao Yu
561,PointWeb: Enhancing Local Neighborhood Features for Point Cloud Processing,,,,,,Wednesday,Poster 2.1,102,Hengshuang Zhao
562,Texture Mixer: A Network for Controllable Synthesis and Interpolation of Texture,,,,,,Thursday,Poster 3.2,139,Ning Yu
563,Convolutional Relational Machine for Group Activity Recognition,,,,,,Wednesday,Poster 2.2,117,Sina Mokhtarzadeh Azar
564,Privacy Protection in Street-View Panoramas Using Depth and Multi-View Imagery,,,,,,Thursday,Poster 3.1,212,Ries Uittenbogaard
565,PMS-Net: Robust Haze Removal Based on Patch Map for Single Images,,,,,,Thursday,Poster 3.2,72,Wei-Ting Chen
566,CrDoCo: Pixel-Level Domain Transfer With Cross-Domain Consistency,,,,,,Tuesday,Poster 1.1,181,Yun-Chun Chen
567,Focus Is All You Need: Loss Functions for Event-Based Vision,,,,,,Thursday,Poster 3.2,169,Guillermo Gallego
568,Bilateral Cyclic Constraint and Adaptive Regularization for Unsupervised Monocular Depth Prediction,,,,,,Wednesday,Poster 2.1,125,Alex Wong
569,Scene Parsing via Integrated Classification Model and Variance-Based Regularization,,,,,,Wednesday,Poster 2.1,76,Hengcan Shi
570,Importance Estimation for Neural Network Pruning,,,,,,Thursday,Poster 3.2,29,Pavlo Molchanov
571,TraPHic: Trajectory Prediction in Dense and Heterogeneous Traffic Using Weighted Interactions,,,,,,Wednesday,Poster 2.2,213,Rohan Chandra
572,Neighbourhood Watch: Referring Expression Comprehension via Language-Guided Graph Attention Networks,,,,,,Tuesday,Poster 1.1,198,Peng Wang
573,Grounding Human-To-Vehicle Advice for Self-Driving Vehicles,,,,,,Thursday,Poster 3.1,213,Jinkyu Kim
574,Divergence Prior and Vessel-Tree Reconstruction,,,,,,Thursday,Poster 3.1,160,Zhongwen Zhang
575,Rules of the Road: Predicting Driving Behavior With a Convolutional Model of Semantic Interactions,,,,,,Wednesday,Poster 2.2,210,Joey Hong
576,TraVeLGAN: Image-To-Image Translation by Transformation Vector Learning,,,,,,Thursday,Poster 3.1,3,Matthew Amodio
577,IRLAS: Inverse Reinforcement Learning for Architecture Search,,,,,,Thursday,Poster 3.1,7,Minghao Guo
578,Scene Categorization From Contours: Medial Axis Based Salience Measures,,,,,,Tuesday,Poster 1.2,201,Morteza Rezanejad
579,Single Image Depth Estimation Trained via Depth From Defocus Cues,,,,,,Wednesday,Poster 2.2,96,Shir Gur
580,MBS: Macroblock Scaling for CNN Model Reduction,,,,,,Thursday,Poster 3.1,17,Yu-Hsun Lin
581,Deep Video Inpainting,,,,,,Wednesday,Poster 2.1,155,Dahun Kim
582,Deep Asymmetric Metric Learning via Rich Relationship Mining,,,,,,Tuesday,Poster 1.2,197,Xinyi Xu
583,GSPN: Generative Shape Proposal Network for 3D Instance Segmentation in Point Cloud,,,,,,Tuesday,Poster 1.2,184,Li Yi
584,Engaging Image Captioning via Personality,,,,,,Thursday,Poster 3.2,193,Kurt Shuster
585,Quasi-Unsupervised Color Constancy,,,,,,Thursday,Poster 3.2,144,Simone Bianco
586,Typography With Decor: Intelligent Text Style Transfer,,,,,,Wednesday,Poster 2.1,165,Wenjing Wang
587,Convolutional Neural Networks Can Be Deceived by Visual Illusions,,,,,,Thursday,Poster 3.2,172,Alexander Gomez-Villa
588,Label Propagation for Deep Semi-Supervised Learning,,,,,,Wednesday,Poster 2.1,52,Ahmet Iscen
589,Recurrent Neural Networks With Intra-Frame Iterations for Video Deblurring,,,,,,Wednesday,Poster 2.2,156,Seungjun Nah
590,K-Nearest Neighbors Hashing,,,,,,Tuesday,Poster 1.2,36,Xiangyu He
591,Deep Flow-Guided Video Inpainting,,,,,,Tuesday,Poster 1.2,143,Rui Xu
592,Fast and Robust Multi-Person 3D Pose Estimation From Multiple Views,,,,,,Wednesday,Poster 2.2,107,Junting Dong
593,End-To-End Time-Lapse Video Synthesis From a Single Outdoor Image,,,,,,Tuesday,Poster 1.1,142,Seonghyeon Nam
594,Face Parsing With RoI Tanh-Warping,,,,,,Wednesday,Poster 2.1,126,Jinpeng Lin
595,Graph Convolutional Label Noise Cleaner: Train a Plug-And-Play Action Classifier for Anomaly Detection,,,,,,Tuesday,Poster 1.1,125,Jia-Xing Zhong
596,Dichromatic Model Based Temporal Color Constancy for AC Light Sources,,,,,,Thursday,Poster 3.2,174,Jun-Sang Yoo
597,Snapshot Distillation: Teacher-Student Optimization in One Generation,,,,,,Tuesday,Poster 1.2,38,Chenglin Yang
598,Large Scale Incremental Learning,,,,,,Tuesday,Poster 1.1,14,Yue Wu
599,Variational Autoencoders Pursue PCA Directions (by Accident),,,,,,Thursday,Poster 3.2,182,Michal Rolinek
600,SpherePHD: Applying CNNs on a Spherical PolyHeDron Representation of 360deg Images,,,,,,Thursday,Poster 3.1,24,Yeonkun Lee
601,Learning With Batch-Wise Optimal Transport Loss for 3D Shape Recognition,,,,,,Tuesday,Poster 1.2,86,Lin Xu
602,EV-Gait: Event-Based Robust Gait Recognition Using Dynamic Vision Sensors,,,,,,Wednesday,Poster 2.1,213,Yanxiang Wang
603,Reducing Uncertainty in Undersampled MRI Reconstruction With Active Acquisition,,,,,,Tuesday,Poster 1.1,207,Zizhao Zhang
604,Cross-Modal Self-Attention Network for Referring Image Segmentation,,,,,,Thursday,Poster 3.1,189,Linwei Ye
605,Residual Regression With Semantic Prior for Crowd Counting,,,,,,Tuesday,Poster 1.2,193,Jia Wan
606,LaserNet: An Efficient Probabilistic 3D Object Detector for Autonomous Driving,,,,,,Thursday,Poster 3.2,209,Gregory P. Meyer
607,VITAMIN-E: VIsual Tracking and MappINg With Extremely Dense Feature Points,,,,,,Thursday,Poster 3.1,101,Masashi Yokozuka
608,Atlas of Digital Pathology: A Generalized Hierarchical Histological Tissue Type-Annotated Database for Deep Learning,,,,,,Thursday,Poster 3.2,79,Mahdi S. Hosseini
609,ROI Pooled Correlation Filters for Visual Tracking,,,,,,Wednesday,Poster 2.1,154,Yuxuan Sun
610,Divide and Conquer the Embedding Space for Metric Learning,,,,,,Tuesday,Poster 1.1,24,Artsiom Sanakoyeu
611,Circulant Binary Convolutional Networks: Enhancing the Performance of 1-Bit DCNNs With Circulant Back Propagation,,,,,,Tuesday,Poster 1.2,3,Chunlei Liu
612,Attention-Guided Unified Network for Panoptic Segmentation,,,,,,Wednesday,Poster 2.2,10,Yanwei Li
613,Hierarchical Deep Stereo Matching on High-Resolution Images,,,,,,Wednesday,Poster 2.1,97,Gengshan Yang
614,Intention Oriented Image Captions With Guiding Objects,,,,,,Wednesday,Poster 2.2,204,Yue Zheng
615,Weakly Supervised Video Moment Retrieval From Text Queries,,,,,,Thursday,Poster 3.2,63,Niluthpol Chowdhury Mithun
616,Spatial Fusion GAN for Image Synthesis,,,,,,Tuesday,Poster 1.2,136,Fangneng Zhan
617,Effective Aesthetics Prediction With Multi-Level Spatially Pooled Features,,,,,,Thursday,Poster 3.1,44,Vlad Hosu
618,AANet: Attribute Attention Network for Person Re-Identifications,,,,,,Wednesday,Poster 2.2,21,Chiat-Pin Tay
619,Feature-Level Frankenstein: Eliminating Variations for Discriminative Recognition,,,,,,Tuesday,Poster 1.1,41,Xiaofeng Liu
620,Interaction-And-Aggregation Network for Person Re-Identification,,,,,,Thursday,Poster 3.1,38,Ruibing Hou
621,Generating 3D Adversarial Point Clouds,,,,,,Thursday,Poster 3.1,19,Chong Xiang
622,Veritatem Dies Aperit - Temporally Consistent Depth Prediction Enabled by a Multi-Task Geometric and Semantic Scene Understanding Approach,,,,,,Tuesday,Poster 1.2,90,Amir Atapour-Abarghouei
623,Photo Wake-Up: 3D Character Animation From a Single Photo,,,,,,Wednesday,Poster 2.1,167,Chung-Yi Weng
624,Multi-Similarity Loss With General Pair Weighting for Deep Metric Learning,,,,,,Wednesday,Poster 2.1,47,Xun Wang
625,Adversarial Defense by Stratified Convolutional Sparse Coding,,,,,,Thursday,Poster 3.2,48,Bo Sun
626,Customizable Architecture Search for Semantic Segmentation,,,,,,Thursday,Poster 3.2,68,Yiheng Zhang
627,Neuro-Inspired Eye Tracking With Eye Movement Dynamics,,,,,,Thursday,Poster 3.1,120,Kang Wang
628,Inverse Cooking: Recipe Generation From Food Images,,,,,,Thursday,Poster 3.1,184,Amaia Salvador
629,On Learning Density Aware Embeddings,,,,,,Wednesday,Poster 2.1,33,Soumyadeep Ghosh
630,Accelerating Convolutional Neural Networks via Activation Map Compression,,,,,,Wednesday,Poster 2.2,16,Georgios Georgiadis
631,Characterizing and Avoiding Negative Transfer,,,,,,Thursday,Poster 3.2,32,Zirui Wang
632,Weakly Supervised Image Classification Through Noise Regularization,,,,,,Thursday,Poster 3.2,55,Mengying Hu
633,You Reap What You Sow: Using Videos to Generate High Precision Object Proposals for Weakly-Supervised Object Detection,,,,,,Thursday,Poster 3.1,48,Krishna Kumar Singh
634,On Implicit Filter Level Sparsity in Convolutional Neural Networks,,,,,,Tuesday,Poster 1.1,29,Dushyant Mehta
635,T-Net: Parametrizing Fully Convolutional Nets With a Single High-Order Tensor,,,,,,Wednesday,Poster 2.2,110,Jean Kossaifi
636,Dense Intrinsic Appearance Flow for Human Pose Transfer,,,,,,Tuesday,Poster 1.2,140,Yining Li
637,Learning Binary Code for Personalized Fashion Recommendation,,,,,,Thursday,Poster 3.1,210,Zhi Lu
638,Hyperspectral Image Super-Resolution With Optimized RGB Guidance,,,,,,Thursday,Poster 3.2,70,Ying Fu
639,Learning Active Contour Models for Medical Image Segmentation,,,,,,Thursday,Poster 3.2,67,Xu Chen
640,Graph Attention Convolution for Point Cloud Semantic Segmentation,,,,,,Thursday,Poster 3.1,168,Lei Wang
641,Coordinate-Based Texture Inpainting for Pose-Guided Human Image Generation,,,,,,Thursday,Poster 3.2,136,Artur Grigorev
642,Detection Based Defense Against Adversarial Examples From the Steganalysis Point of View,,,,,,Wednesday,Poster 2.1,27,Jiayang Liu
643,A Parametric Top-View Representation of Complex Road Scenes,,,,,,Thursday,Poster 3.1,171,Ziyan Wang
644,Unsupervised Learning of Consensus Maximization for 3D Vision Problems,,,,,,Tuesday,Poster 1.1,70,Thomas Probst
645,LVIS: A Dataset for Large Vocabulary Instance Segmentation,,,,,,Wednesday,Poster 2.1,81,Agrim Gupta
646,Triangulation Learning Network: From Monocular to Stereo 3D Object Detection,,,,,,Wednesday,Poster 2.2,89,Zengyi Qin
647,Audio Visual Scene-Aware Dialog,,,,,,Wednesday,Poster 2.2,83,Huda Alamri
648,Graph-Based Global Reasoning Networks,,,,,,Tuesday,Poster 1.1,20,Yunpeng Chen
649,Adversarial Structure Matching for Structured Prediction Tasks,,,,,,Tuesday,Poster 1.2,195,Jyh-Jing Hwang
650,Improved Road Connectivity by Joint Learning of Orientation and Segmentation,,,,,,Thursday,Poster 3.1,177,Anil Batra
651,Deep Modular Co-Attention Networks for Visual Question Answering,,,,,,Wednesday,Poster 2.1,205,Zhou Yu
652,"Face Anti-Spoofing: Model Matters, so Does Data",,,,,,Tuesday,Poster 1.2,103,Xiao Yang
653,Unsupervised Domain-Specific Deblurring via Disentangled Representations,,,,,,Thursday,Poster 3.1,161,Boyu Lu
654,Hybrid Task Cascade for Instance Segmentation,,,,,,Wednesday,Poster 2.1,42,Kai Chen
655,RL-GAN-Net: A Reinforcement Learning Agent Controlled GAN Network for Real-Time Point Cloud Shape Completion,,,,,,Wednesday,Poster 2.1,166,Muhammad Sarmad
656,Unsupervised Domain Adaptation Using Feature-Whitening and Consensus Loss,,,,,,Thursday,Poster 3.1,54,Subhankar Roy
657,Propagation Mechanism for Deep and Wide Neural Networks,,,,,,Thursday,Poster 3.1,28,Dejiang Xu
658,ODE-Inspired Network Design for Single Image Super-Resolution,,,,,,Tuesday,Poster 1.1,175,Xiangyu He
659,MirrorGAN: Learning Text-To-Image Generation by Redescription,,,,,,Tuesday,Poster 1.1,152,Tingting Qiao
660,What's to Know? Uncertainty as a Guide to Asking Goal-Oriented Questions,,,,,,Tuesday,Poster 1.2,205,Ehsan Abbasnejad
661,Pushing the Envelope for RGB-Based Dense 3D Hand Pose Estimation via Neural Rendering,,,,,,Tuesday,Poster 1.1,96,Seungryul Baek
662,Improving Referring Expression Grounding With Cross-Modal Attention-Guided Erasing,,,,,,Tuesday,Poster 1.1,197,Xihui Liu
663,ShieldNets: Defending Against Adversarial Attacks Using Probabilistic Adversarial Robustness,,,,,,Wednesday,Poster 2.2,6,Rajkumar Theagarajan
664,Semi-Supervised Transfer Learning for Image Rain Removal,,,,,,Tuesday,Poster 1.2,159,Wei Wei
665,Assessing Personally Perceived Image Quality via Image Features and Collaborative Filtering,,,,,,Wednesday,Poster 2.2,163,Jari Korhonen
666,A Simple Pooling-Based Design for Real-Time Salient Object Detection,,,,,,Tuesday,Poster 1.2,163,Jiang-Jiang Liu
667,Layout-Graph Reasoning for Fashion Landmark Detection,,,,,,Tuesday,Poster 1.2,46,Weijiang Yu
668,RES-PCA: A Scalable Approach to Recovering Low-Rank Matrices,,,,,,Wednesday,Poster 2.2,58,Chong Peng
669,Two-Stream Adaptive Graph Convolutional Networks for Skeleton-Based Action Recognition,,,,,,Thursday,Poster 3.2,125,Lei Shi
670,Universal Domain Adaptation,,,,,,Tuesday,Poster 1.2,6,Kaichao You
671,Using Unknown Occluders to Recover Hidden Scenes,,,,,,Thursday,Poster 3.2,146,Adam B. Yedidia
672,Learning Unsupervised Video Object Segmentation Through Visual Attention,,,,,,Tuesday,Poster 1.2,59,Wenguan Wang
673,Turn a Silicon Camera Into an InGaAs Camera,,,,,,Wednesday,Poster 2.1,175,Feifan Lv
674,Object Detection With Location-Aware Deformable Convolution and Backward Attention Filtering,,,,,,Thursday,Poster 3.1,52,Chen Zhang
675,Contrast Prior and Fluid Pyramid Integration for RGBD Salient Object Detection,,,,,,Tuesday,Poster 1.2,164,Jia-Xing Zhao
676,Action Recognition From Single Timestamp Supervision in Untrimmed Videos,,,,,,Thursday,Poster 3.1,129,Davide Moltisanti
677,D3TW: Discriminative Differentiable Dynamic Time Warping for Weakly Supervised Action Alignment and Segmentation,,,,,,Tuesday,Poster 1.2,107,Chien-Yi Chang
678,Interactive Image Segmentation via Backpropagating Refinement Scheme,,,,,,Wednesday,Poster 2.1,75,Won-Dong Jang
679,Learning Channel-Wise Interactions for Binary Convolutional Neural Networks,,,,,,Tuesday,Poster 1.1,34,Ziwei Wang
680,Deep Multimodal Clustering for Unsupervised Audiovisual Learning,,,,,,Thursday,Poster 3.1,31,Di Hu
681,Leveraging Heterogeneous Auxiliary Tasks to Assist Crowd Counting,,,,,,Thursday,Poster 3.2,215,Muming Zhao
682,AdaFrame: Adaptive Frame Selection for Fast Video Recognition,,,,,,Tuesday,Poster 1.1,129,Zuxuan Wu
683,World From Blur,,,,,,Wednesday,Poster 2.2,214,Jiayan Qiu
684,EventNet: Asynchronous Recursive Event Processing,,,,,,Tuesday,Poster 1.2,160,Yusuke Sekikawa
685,Towards Accurate One-Stage Object Detection With AP-Loss,,,,,,Wednesday,Poster 2.1,57,Kean Chen
686,Completeness Modeling and Context Separation for Weakly Supervised Temporal Action Localization,,,,,,Tuesday,Poster 1.1,131,Daochang Liu
687,Iterative Residual Refinement for Joint Optical Flow and Occlusion Estimation,,,,,,Wednesday,Poster 2.1,151,Junhwa Hur
688,Progressive Feature Alignment for Unsupervised Domain Adaptation,,,,,,Tuesday,Poster 1.1,40,Chaoqi Chen
689,Domain-Symmetric Networks for Adversarial Domain Adaptation,,,,,,Wednesday,Poster 2.1,48,Yabin Zhang
690,Multi-Granularity Generator for Temporal Action Proposal,,,,,,Tuesday,Poster 1.2,113,Yuan Liu
691,Interpretable and Fine-Grained Visual Explanations for Convolutional Neural Networks,,,,,,Thursday,Poster 3.1,15,Jorg Wagner
692,Dissecting Person Re-Identification From the Viewpoint of Viewpoint,,,,,,Tuesday,Poster 1.1,38,Xiaoxiao Sun
693,Weakly Supervised Complementary Parts Models for Fine-Grained Image Classification From the Bottom Up,,,,,,Tuesday,Poster 1.2,56,Weifeng Ge
694,Guided Stereo Matching,,,,,,Tuesday,Poster 1.1,87,Matteo Poggi
695,Hierarchical Disentanglement of Discriminative Latent Features for Zero-Shot Learning,,,,,,Thursday,Poster 3.2,50,Bin Tong
696,Classification-Reconstruction Learning for Open-Set Recognition,,,,,,Tuesday,Poster 1.2,191,Ryota Yoshihashi
697,Learning Non-Volumetric Depth Fusion Using Successive Reprojections,,,,,,Wednesday,Poster 2.2,91,Simon Donne
698,A Variational Pan-Sharpening With Local Gradient Constraints,,,,,,Thursday,Poster 3.1,165,Xueyang Fu
699,Bridging Stereo Matching and Optical Flow via Spatiotemporal Correspondence,,,,,,Tuesday,Poster 1.1,191,Hsueh-Ying Lai
700,Non-Adversarial Image Synthesis With Generative Latent Nearest Neighbors,,,,,,Wednesday,Poster 2.1,157,Yedid Hoshen
701,An End-To-End Network for Panoptic Segmentation,,,,,,Wednesday,Poster 2.1,194,Huanyu Liu
702,Neural Scene Decomposition for Multi-Person Motion Capture,,,,,,Wednesday,Poster 2.2,98,Helge Rhodin
703,ToothNet: Automatic Tooth Instance Segmentation and Identification From Cone Beam CT Images,,,,,,Wednesday,Poster 2.1,214,Zhiming Cui
704,Unsupervised Disentangling of Appearance and Geometry by Deformable Generator Network,,,,,,Thursday,Poster 3.1,174,Xianglei Xing
705,Exploiting Temporal Context for 3D Human Pose Estimation in the Wild,,,,,,Tuesday,Poster 1.2,92,Anurag Arnab
706,Reflection Removal Using a Dual-Pixel Sensor,,,,,,Tuesday,Poster 1.1,157,Abhijith Punnappurath
707,A Variational Auto-Encoder Model for Stochastic Point Processes,,,,,,Tuesday,Poster 1.2,69,Nazanin Mehrasa
708,StoryGAN: A Sequential Conditional GAN for Story Visualization,,,,,,Wednesday,Poster 2.1,210,Yitong Li
709,Cyclic Guidance for Weakly Supervised Joint Detection and Segmentation,,,,,,Tuesday,Poster 1.1,47,Yunhang Shen
710,RepMet: Representative-Based Metric Learning for Classification and Few-Shot Object Detection,,,,,,Wednesday,Poster 2.1,65,Leonid Karlinsky
711,Deep ChArUco: Dark ChArUco Marker Pose Estimation,,,,,,Wednesday,Poster 2.2,208,Danying Hu
712,Region Proposal by Guided Anchoring,,,,,,Tuesday,Poster 1.2,49,Jiaqi Wang
713,Learning-Based Sampling for Natural Image Matting,,,,,,Tuesday,Poster 1.2,58,Jingwei Tang
714,Amodal Instance Segmentation With KINS Dataset,,,,,,Tuesday,Poster 1.2,54,Lu Qi
715,Actively Seeking and Learning From Live Data,,,,,,Tuesday,Poster 1.1,196,Damien Teney
716,Depth Coefficients for Depth Completion,,,,,,Thursday,Poster 3.2,186,Saif Imran
717,PDE Acceleration for Active Contours,,,,,,Thursday,Poster 3.2,173,Anthony Yezzi
718,On the Intrinsic Dimensionality of Image Representations,,,,,,Tuesday,Poster 1.2,188,Sixue Gong
719,PA3D: Pose-Action 3D Machine for Video Recognition,,,,,,Wednesday,Poster 2.2,120,An Yan
720,UniformFace: Learning Deep Equidistributed Representation for Face Recognition,,,,,,Tuesday,Poster 1.2,94,Yueqi Duan
721,Direct Object Recognition Without Line-Of-Sight Using Optical Coherence,,,,,,Thursday,Poster 3.2,78,Xin Lei
722,Deep Dual Relation Modeling for Egocentric Interaction Recognition,,,,,,Wednesday,Poster 2.2,121,Haoxin Li
723,Learning Independent Object Motion From Unlabelled Stereoscopic Videos,,,,,,Wednesday,Poster 2.1,105,Zhe Cao
724,Spectral Metric for Dataset Complexity Assessment,,,,,,Tuesday,Poster 1.2,74,Frederic Branchaud-Charron
725,Progressive Ensemble Networks for Zero-Shot Recognition,,,,,,Thursday,Poster 3.2,77,Meng Ye
726,Frame-Consistent Recurrent Video Deraining With Dual-Level Flow,,,,,,Tuesday,Poster 1.1,168,Wenhan Yang
727,Grid R-CNN,,,,,,Wednesday,Poster 2.2,63,Xin Lu
728,Spatial-Aware Graph Relation Network for Large-Scale Object Detection,,,,,,Thursday,Poster 3.1,36,Hang Xu
729,Cross-Classification Clustering: An Efficient Multi-Object Tracking Technique for 3-D Instance Segmentation in Connectomics,,,,,,Wednesday,Poster 2.2,207,Yaron Meirovitch
730,ECC: Platform-Independent Energy-Constrained Deep Neural Network Compression via a Bilinear Regression Model,,,,,,Thursday,Poster 3.2,23,Haichuan Yang
731,Led3D: A Lightweight and Efficient Deep Approach to Recognizing Low-Quality 3D Faces,,,,,,Wednesday,Poster 2.1,153,Guodong Mu
732,MSCap: Multi-Style Image Captioning With Unpaired Stylized Text,,,,,,Tuesday,Poster 1.2,210,Longteng Guo
733,On Stabilizing Generative Adversarial Training With Noise,,,,,,Thursday,Poster 3.2,137,Simon Jenni
734,DDLSTM: Dual-Domain LSTM for Cross-Dataset Action Recognition,,,,,,Wednesday,Poster 2.2,113,Toby Perrett
735,Weakly Supervised Open-Set Domain Adaptation by Dual-Domain Collaboration,,,,,,Wednesday,Poster 2.1,85,Shuhan Tan
736,MARS: Motion-Augmented RGB Stream for Action Recognition,,,,,,Wednesday,Poster 2.2,116,Nieves Crasto
737,Less Is More: Learning Highlight Detection From Video Duration,,,,,,Tuesday,Poster 1.1,127,Bo Xiong
738,3D Motion Decomposition for RGBD Future Dynamic Scene Synthesis,,,,,,Wednesday,Poster 2.2,95,Xiaojuan Qi
739,Distraction-Aware Shadow Detection,,,,,,Wednesday,Poster 2.1,62,Quanlong Zheng
740,Unifying Heterogeneous Classifiers With Distillation,,,,,,Tuesday,Poster 1.2,70,Jayakorn Vongkulbhisal
741,Self-Supervised Representation Learning by Rotation Feature Decoupling,,,,,,Thursday,Poster 3.1,175,Zeyu Feng
742,Compressing Convolutional Neural Networks via Factorized Convolutional Filters,,,,,,Tuesday,Poster 1.2,187,Tuanhui Li
743,Discovering Fair Representations in the Data Domain,,,,,,Wednesday,Poster 2.2,169,Novi Quadrianto
